companyI,AddI,CompanyK,AddK,INBUILDING,EXTBUILDING,POILOGISTIC,ZONE,DISTRICT,HOUSENUM,ROADNAME,POBOX,ZIPCODE,CITY,COUNTRY,INBUILDINGK,EXTBUILDINGK,POILOGISTICK,ZONEK,DISTRICTK,HOUSENUMK,ROADNAMEK,POBOXK,ZIPCODEK,CITYK,COUNTRYK,NewLabel
SOCIT DES TRANSPORTS DE COTE D'OR,2 RUE DU PORT 21600 LONGVIC FRANCE,HEPPNER SOCIETE DE TRANSPORTS,7 RUE DU PORT 21600 LONGVIC France,NONE,NONE,NONE,NONE,NONE,2,RUE DU PORT,NONE,21600,LONGVIC,FRANCE,NONE,NONE,NONE,NONE,NONE,7,RUE DU PORT,NONE,21600,LONGVIC,FRANCE,PartialMatch
KUEHNE ET NAGEL,RUE CHARLES PICARD 57365 ENNERY FRANCE,KUEHNE NAGEL ROAD,RUE CHARLES PICARD ZONE INDUSTRIELLE DES JONQUIERES 57365 ENNERY France,NONE,NONE,NONE,NONE,NONE,NONE,RUE CHARLES PICARD,NONE,57365,ENNERY,FRANCE,NONE,NONE,NONE,ZONE INDUSTRIELLE DES JONQUIERES,NONE,NONE,RUE CHARLES PICARD,NONE,57365,ENNERY,FRANCE,Match
BOISSEL,RUE LAVOISIER 29500 ERGUE GABERIC France,TRANSPORTS BOISSEL BOISSEL TRANSPORTS,RUE LAVOISIER 29500 ERGUE GABERIC France,NONE,NONE,NONE,NONE,NONE,NONE,RUE LAVOISIER,NONE,29500,ERGUE GABERIC,FRANCE,NONE,NONE,NONE,NONE,NONE,NONE,RUE LAVOISIER,NONE,29500,ERGUE GABERIC,FRANCE,Match
TRANSPORTS PASCUAL ET FILS,AVENUE DE BRUMAS 47390 LAYRAC FRANCE,TRANSPORTS PASCUAL ET FILS,AV DE BRUMAS 47390 LAYRAC France,NONE,NONE,NONE,NONE,NONE,NONE,AVENUE DE BRUMAS,NONE,47390,LAYRAC,FRANCE,NONE,NONE,NONE,NONE,NONE,NONE,AVENUE DE BRUMAS,NONE,47390,LAYRAC,FRANCE,Match
TRANSPORTS CAPELLE,ZI - RUE NIEPCE 59710 PONT A MARCQ FRANCE,CAPELLE TRANSPORTS CAPELLE,RUE NIECEPHARE 59710 PONT \xc0 MARCQ France,NONE,NONE,NONE,ZONE INDUSTRIELLE,NONE,NONE,RUE NIEPCE,NONE,59710,PONT A MARCQ,FRANCE,NONE,NONE,NONE,NONE,NONE,NONE,RUE NIECE,NONE,59710,PONT A MARCQ,FRANCE,Match
SOBOTRAM,30 B rue Paul Sabatier BP 71530 CRISSEY France,SOBOROUTE SOBOROUTE S.A.S.,25 RUE PAUL SABATIER 71530 CRISSEY France,NONE,NONE,NONE,NONE,NONE,NONE,RUE PAUL SABATIER,BP 71530,NONE,CRISSEY,FRANCE,NONE,NONE,NONE,NONE,NONE,25,RUE PAUL SABATIER,NONE,71530,CRISSEY,FRANCE,PartialMatch
SOBOTRAM,30 B rue Paul Sabatier BP 71530 CRISSEY France,SOBOTRAM TRANSPORTS ET LOGISTIQUE,27 RUE PAUL SABATIER 25 71530 CRISSEY France,NONE,NONE,NONE,NONE,NONE,NONE,RUE PAUL SABATIER,BP 71530,NONE,CRISSEY,FRANCE,NONE,NONE,NONE,NONE,NONE,27,RUE PAUL SABATIER,NONE,71530,CRISSEY,FRANCE,PartialMatch
BAY LUCIEN ( TRANSPORT ),RUE PRINCIPALE 62850 SURQUES FRANCE,SARL BAY LUCIEN,RUE PRINCIPALE 62850 SURQUES France,NONE,NONE,NONE,NONE,NONE,NONE,RUE PRINCIPALE,NONE,62850,SURQUES,FRANCE,NONE,NONE,NONE,NONE,NONE,NONE,RUE PRINCIPALE,NONE,62850,SURQUES,FRANCE,Match
TRANSPORTS MARQUET,RUE PAUL EMILE VICTOR 69780 MIONS FRANCE,TRANSPORTS MARQUET,RUE PAUL EMILE VICTOR 69780 MIONS France,NONE,NONE,NONE,NONE,NONE,NONE,RUE PAUL EMILE VICTOR,NONE,69780,MIONS,FRANCE,NONE,NONE,NONE,NONE,NONE,NONE,RUE PAUL EMILE VICTOR,NONE,69780,MIONS,FRANCE,Match
MARC,ROUTE DE SAINT-ANDR 09130 LE FOSSAT FRANCE,MARC,RTE SAINT ANDRE 09130 LE FOSSAT France,NONE,NONE,NONE,NONE,NONE,NONE,ROUTE DE SAINT ANDR,NONE,9130,LE FOSSAT,FRANCE,NONE,NONE,NONE,NONE,NONE,NONE,ROUTE SAINT ANDRE,NONE,9130,LE FOSSAT,FRANCE,Match
BERNIS TRUCKS,RUE DES LANDES 86000 POITIERS France,BERNIS TRUCKS,RUE DES LANDES ZONE REPUBLIQUE III 86000 POITIERS France,NONE,NONE,NONE,NONE,NONE,NONE,RUE DES LANDES,NONE,86000,POITIERS,FRANCE,NONE,NONE,NONE,ZONE REPUBLIQUE III,NONE,NONE,RUE DES LANDES,NONE,86000,POITIERS,FRANCE,Match
MARTIN ET FILS TRANSPORTS,ROUTE DE STE BP 10 34302 AGDE CDEX FRANCE,TRANSPORTS A. MARTIN & FILS SA TRANSPORTS A. MARTIN ET FILS,RTE DE SETE 34300 AGDE France,NONE,NONE,NONE,NONE,NONE,NONE,ROUTE DE SETE,BP 10,34302,AGDE,FRANCE,NONE,NONE,NONE,NONE,NONE,NONE,ROUTE DE SETE,NONE,34300,AGDE,FRANCE,Match
TRANSPORTS PASCUAL ET FILS,AVENUE DE BRUMAS 47390 LAYRAC FRANCE,TRANSPORTS PASCUAL ET FILS,AV DE BRUMAS 47390 LAYRAC France,NONE,NONE,NONE,NONE,NONE,NONE,AVENUE DE BRUMAS,NONE,47390,LAYRAC,FRANCE,NONE,NONE,NONE,NONE,NONE,NONE,AVENUE DE BRUMAS,NONE,47390,LAYRAC,FRANCE,Match
TRANSPORTS DELCROIX DE DOUAI,Rue Francisco Ferrer 59950 AUBY France,TRANSPORTS DELCROIX DE DOUAI,RUE FRANCISCO FERRER 59950 AUBY France,NONE,NONE,NONE,NONE,NONE,NONE,RUE FRANCISCO FERRER,NONE,59950,AUBY,FRANCE,NONE,NONE,NONE,NONE,NONE,NONE,RUE FRANCISCO FERRER,NONE,59950,AUBY,FRANCE,Match
TRANSPORTS ALAINE,Zi sud - rue de la Grosne 71000 MACON France,TRANSPORTS ALAINE,RUE DE LA GROSNE Z.I. SUD GROSNE 71000 MACON France,NONE,NONE,NONE,ZONE INDUSTRIELLE SUD,NONE,NONE,RUE DE LA GROSNE,NONE,71000,MACON,FRANCE,NONE,NONE,NONE,ZONE INDUSTRIELLE SUD GROSNE,NONE,NONE,RUE DE LA GROSNE,NONE,71000,MACON,FRANCE,Match
TRANSPORTS DELAUNAY,19 RUE DES OSMEAUX 28100 DREUX France,DELAUNAY LOGISTIQUE,8 RUE DES OSMEAUX 28100 DREUX France,NONE,NONE,NONE,NONE,NONE,19,RUE DES OSMEAUX,NONE,28100,DREUX,FRANCE,NONE,NONE,NONE,NONE,NONE,8,RUE DES OSMEAUX,NONE,28100,DREUX,FRANCE,PartialMatch
GABORIT,18 RUE MARQUENAVE 64530 PONTACQ FRANCE,ETS GABORIT ET FILS ETABLISSEMENT GABORIT ET FILS,22 RUE RUE MARQUENAVE 64530 PONTACQ France,NONE,NONE,NONE,NONE,NONE,18,RUE MARQUENAVE,NONE,64530,PONTACQ,FRANCE,NONE,NONE,NONE,NONE,NONE,22,RUE RUE MARQUENAVE,NONE,64530,PONTACQ,FRANCE,PartialMatch
TRANSPORTS CLAVEAU,RUE DE L'INDUSTRIE 41290 OUCQUES FRANCE,TRANSPORT CLAVEAU TRANSPORTS CLAVEAU,RUE DE L'INDUSTRIE 41290 OUCQUES LA NOUVELLE France,NONE,NONE,NONE,NONE,NONE,NONE,RUE DE L'INDUSTRIE,NONE,41290,OUCQUES,FRANCE,NONE,NONE,NONE,NONE,NONE,NONE,RUE DE L'INDUSTRIE,NONE,41290,OUCQUES,FRANCE,Match
TRANSPORT HUCK,3 Rue Adolphe Moehler - ZI Nord 67210 OBERNAI France,TRANSPORTS HUCK,2 RUE ADOLPHE MOHLER  67210 OBERNAI France,NONE,NONE,NONE,ZONE INDUSTRIELLE NORD,NONE,3,RUE ADOLPHE MOEHLER,NONE,67210,OBERNAI,FRANCE,NONE,NONE,NONE,NONE,NONE,2,RUE ADOLPHE MOHLER,NONE,67210,OBERNAI,FRANCE,PartialMatch
LOTRAF SARL,route de Champlandry BP 58 89600 SAINT FLORENTIN France,LOTRAF,RTE DE CHAMPLANDRY 89600 SAINT FLORENTIN France,NONE,NONE,NONE,NONE,NONE,NONE,ROUTE DE CHAMPLANDRY,BP 58,89600,SAINT FLORENTIN,FRANCE,NONE,NONE,NONE,NONE,NONE,NONE,ROUTE DE CHAMPLANDRY,NONE,89600,SAINT FLORENTIN,FRANCE,Match
GAUTIER MICHEL SARL,ZI - Rue de la Grassinais 35400 SAINT MALO France,TRANSPORTS MICHEL GAUTIER TRANSPORTS MICHEL GAUTIER SARL,9 RUE DE LA GRASSINAIS 35400 SAINT MALO France,NONE,NONE,NONE,ZONE INDUSTRIELLE,NONE,5,RUE DE LA GRASSINAIS,NONE,35400,SAINT MALO,FRANCE,NONE,NONE,NONE,NONE,NONE,9,RUE DE LA GRASSINAIS,NONE,35400,SAINT MALO,FRANCE,PartialMatch
DELISLE S.A.S,Route de Provins BP 25 77320 LA FERTE GAUCHER France,DELISLE SAS,RTE DE PROVINS LD LE PETIT TAILLIS 77320 LA FERTE GAUCHER France,NONE,NONE,NONE,NONE,NONE,NONE,ROUTE DE PROVINS,BP 25,77320,LA FERTE,FRANCE,NONE,NONE,NONE,NONE,NONE,NONE,ROUTE DE PROVINS LIEU DIT LE PETIT TAILLIS,NONE,77320,LA FERTE,FRANCE,Match
TAXICOLIS EST,Rue de la Fort Noire 68390 SAUSHEIM France,FLASH TAXICOLIS,RUE DE LA FORET NOIRE20 68390 SAUSHEIM France,NONE,NONE,NONE,NONE,NONE,NONE,RUE DE LA FORT NOIRE,NONE,68390,SAUSHEIM,FRANCE,NONE,NONE,NONE,NONE,NONE,20,RUE DE LA FORET NOIRE,NONE,68390,SAUSHEIM,FRANCE,Match
TRANSPORTS JACKY,75 Rue du Moulin 67160 CLEEBOURG France,TRANSPORTS JACKY ET FILS,33 RUE DU MOULIN 67160 CLEEBOURG France,NONE,NONE,NONE,NONE,NONE,75,RUE DU MOULIN,NONE,67160,CLEEBOURG,FRANCE,NONE,NONE,NONE,NONE,NONE,33,RUE DU MOULIN,NONE,67160,CLEEBOURG,FRANCE,PartialMatch
CENTRE EXPRESS LIMOUSIN 69,ZI Avenue de Montmartin 69960 CORBAS France,CENTRE EXPRESS LIMOUSIN 69,AV DE MONTMARTIN ZI CORBAS MONTMARTIN 69960 CORBAS France,NONE,NONE,NONE,ZONE INDUSTRIELLE,NONE,NONE,AVENUE DE MONTMARTIN,NONE,69960,CORBAS,FRANCE,NONE,NONE,NONE,ZONE INDUSTRIELLE CORBAS MONTMARTIN,NONE,NONE,AVENUE DE MONTMARTIN,NONE,69960,CORBAS,FRANCE,Match
GAUTIER MICHEL SARL,ZI - 3 Rue de la Grassinais 35400 SAINT MALO France,GAUTIER HOLDING GAUTIER HOLDING,9 RUE DE LA GRASSINAIS 35400 SAINT MALO France,NONE,NONE,NONE,ZONE INDUSTRIELLE,NONE,3,RUE DE LA GRASSINAIS,NONE,35400,SAINT MALO,FRANCE,NONE,NONE,NONE,NONE,NONE,9,RUE DE LA GRASSINAIS,NONE,35400,SAINT MALO,FRANCE,PartialMatch
ENVOYE SPECIAL,VOIE DES BARGES ROUSSES PARC DES ALIZES I 76430 SANDOUVILLE France,ENVOYE SPECIAL NORMANDIE ENVOY\XE9 SP\XE9CIAL,VOIE DES BARGES ROUSSES PARC DES ALIZES I 76430 SANDOUVILLE France,NONE,NONE,NONE,PARC ACTIVITERC DES ALIZES I,NONE,NONE,VOIE DES BARGES ROUSSES,NONE,76430,SANDOUVILLE,FRANCE,NONE,NONE,NONE,PARC ACTIVITERC DES ALIZES I,NONE,NONE,VOIE DES BARGES ROUSSES,NONE,76430,SANDOUVILLE,FRANCE,Match
BOUTET ET FILS,avenue de Bamberg 12000 RODEZ France,BOUTET PRIMEURS BOUTET ET FILS SARL,AV DE BAMBERG 12000 RODEZ France,NONE,NONE,NONE,NONE,NONE,NONE,AVENUE DE BAMBERG,NONE,12000,RODEZ,FRANCE,NONE,NONE,NONE,NONE,NONE,NONE,AVENUE DE BAMBERG,NONE,12000,RODEZ,FRANCE,Match
SOCIT GNRALE DE MANUTENTION ET TRANSIT,20 Rue du Qubec 17009 LA ROCHELLE France,SOC GENERALE DE MANUTENTION ET TRANSIT SOCI\XE9T\XE9 G\XE9N\XE9RALE DE MANUTENTION ET DE TRANSIT,8 RUE QUEBEC ZI DE CHEF DE BAIE 17000 LA ROCHELLE France,NONE,NONE,NONE,NONE,NONE,20,RUE DU QUBEC,NONE,17009,LA ROCHELLE,FRANCE,NONE,NONE,NONE,ZONE INDUSTRIELLE DE CHEF DE BAIE,NONE,8,RUE QUEBEC,NONE,17000,LA ROCHELLE,FRANCE,PartialMatch
SOCIT DES TRANSPORTS PANALPINA FRANCE,Zone de Frt Bat 9 Avenue Didier Daurat 31700 BLAGNAC France,PANALPINA FR TRANSPORTS INTERNATION PANALPINA FRANCE TRANSPORTS INTERNATIONAUX,AV DIDIER DAURAT IMMEUBLE ARISTOTE 31700 BLAGNAC France,NONE,BATIMENT 9,NONE,ZONE DE FRT,NONE,NONE,AVENUE DIDIER DAURAT,NONE,31700,BLAGNAC,FRANCE,NONE,IMMEUBLE ARISTOTE,NONE,NONE,NONE,NONE,AVENUE DIDIER DAURAT,NONE,31700,BLAGNAC,FRANCE,PartialMatch
TRANSPORTS BESOMBE,route de Fendeille 11400 CASTELNAUDARY France,SOCIETE DES TRANSPORTS BESOMBES STE DES TRANSPORTS BESOMBES,RTE DE FENDEILLE Z.I. D'EN TOURRE 11400 CASTELNAUDARY France,NONE,NONE,NONE,NONE,NONE,NONE,ROUTE DE FENDEILLE,NONE,11400,CASTELNAUDARY,FRANCE,NONE,NONE,NONE,ZONE INDUSTRIELLE D'EN TOURRE,NONE,NONE,ROUTE DE FENDEILLE,NONE,11400,CASTELNAUDARY,FRANCE,Match
LARUE CHRISTIAN,Route de Trigny 51140 PROUILLY France,ETABLISSEMENTS CHRISTIAN LARUE,RTE DE TRIGNY 51140 PROUILLY France,NONE,NONE,NONE,NONE,NONE,NONE,ROUTE DE TRIGNY,NONE,51140,PROUILLY,FRANCE,NONE,NONE,NONE,NONE,NONE,NONE,ROUTE DE TRIGNY,NONE,51140,PROUILLY,FRANCE,Match
TRANSPORTS SETAK,ZI du Pic - rue Henri Fabre 30028 09101 PAMIERS CEDEX France,SOC EXPL TRANSPORTS ANDRE KIRMANN S.E. TRANSPORTS ANDRE KIRMANN,RUE HENRI FABRE ZONE D'ACTIVITES DE PIC 09100 PAMIERS France,NONE,NONE,NONE,ZONE INDUSTRIELLE DU PIC,NONE,NONE,RUE HENRI FABRE,NONE,9101,PAMIERS,FRANCE,NONE,NONE,NONE,ZONE D'ACTIVITES DE PIC,NONE,NONE,RUE HENRI FABRE,NONE,9100,PAMIERS,FRANCE,Match
IZARET AQUITAINE,Rue Gustave Eiffel - ZI Tartifume 80 33322 BEGLES Cdex France,LOCATION TRANSPORTS IZARET AQUITAINE,RUE GUSTAVE EIFFEL ZI TARTIFUME 33130 BEGLES France,NONE,NONE,NONE,ZONE INDUSTRIELLE TARTIFUME 80,NONE,NONE,RUE GUSTAVE EIFFEL,NONE,33322,BEGLES,FRANCE,NONE,NONE,NONE,ZONE INDUSTRIELLE TARTIFUME,NONE,NONE,RUE GUSTAVE EIFFEL,NONE,33130,BEGLES,FRANCE,Match
TRANSPORTS GALINIER,Guyor Haut 81260 LE BEZ France,TRANSPORTS GALINIER & FILS,LD GUYOR GUYOR 81260 LE BEZ France,NONE,NONE,NONE,GUYOR HAUT,NONE,NONE,NONE,NONE,81260,LE BEZ,FRANCE,NONE,NONE,NONE,NONE,NONE,NONE,LIEU DIT GUYOR HAUT,NONE,81260,LE BEZ,FRANCE,Match
TRANSPORTS MAZOYER-GARDON,55 Route de Lyon 07340 DAVEZIEUX France,TRANSPORTS MASOYER GARDON,1249 RTE DE LYON 07430 DAVEZIEUX France,NONE,NONE,NONE,NONE,NONE,55,ROUTE DE LYON,NONE,7340,DAVEZIEUX,FRANCE,NONE,NONE,NONE,NONE,NONE,1249,ROUTE DE LYON,NONE,7430,DAVEZIEUX,FRANCE,PartialMatch
TAXICOLIS 54,102 impasse Henri Becquerel 54710 LUDRES France,FLASH TAXICOLIS,102 IMP HENRI BECQUEREL 54710 LUDRES France,NONE,NONE,NONE,NONE,NONE,102,IMPASSE HENRI BECQUEREL,NONE,54710,LUDRES,FRANCE,NONE,NONE,NONE,NONE,NONE,103,IMPASSE HENRI BECQUEREL,NONE,54710,LUDRES,FRANCE,Match
DTS,ROUTE DE PRAYSSAS 47450 COLAYRAC SAINT CIRQ France,DTS TRANSPORTS,RTE ROUTE DE PRAYSSAS 47450 COLAYRAC SAINT CIRQ France,NONE,NONE,NONE,NONE,NONE,NONE,ROUTE DE PRAYSSAS,NONE,47450,COLAYRAC,FRANCE,NONE,NONE,NONE,NONE,NONE,NONE,ROUTE DE PRAYSSAS,NONE,47450,COLAYRAC,FRANCE,Match
DTS,ROUTE DE PRAYSSAS 47450 COLAYRAC SAINT CIRQ France,D.T.S. PROVENCE D.T.S. PROVENCE,RTE DE PRAYSSAS 47450 COLAYRAC SAINT CIRQ France,NONE,NONE,NONE,NONE,NONE,NONE,ROUTE DE PRAYSSAS,NONE,47450,COLAYRAC,FRANCE,NONE,NONE,NONE,NONE,NONE,NONE,ROUTE DE PRAYSSAS,NONE,47450,COLAYRAC,FRANCE,Match
LOCATRANS,11 rue Pierre Martin Z.I de l'inquieterie 62280 St Martin Boulogne France,LOCATRANS 62,47 RUE PIERRE MARTIN 62280 SAINT MARTIN BOULOGNE France,NONE,NONE,NONE,ZONE INDUSTRIELLE DE L'INQUIETERIE,NONE,11,RUE PIERRE MARTIN,NONE,62280,SAINT MARTIN,FRANCE,NONE,NONE,NONE,NONE,NONE,47,RUE PIERRE MARTIN,NONE,62280,SAINT MARTIN,FRANCE,PartialMatch
DSV,50 rue Jean BERTIN 45430 CHECY France,DSV ROAD,33 RUE JEAN BERTIN PARC D'ACTIVITE DE LA GUIGNARDIERE 45430 CHECY France,NONE,NONE,NONE,NONE,NONE,50,RUE JEAN BERTIN,NONE,45430,CHECY,FRANCE,NONE,NONE,NONE,PARC ACTIVITERC D'ACTIVITE DE LA GUIGNARDIERE,NONE,33,RUE JEAN BERTIN,NONE,45430,CHECY,FRANCE,PartialMatch
EDMT,ZA La Prade II - rue des Morilles 33650 SAINT MEDARD D EYRANS France,EDMT,RUE DES MORILLES ZA LE PRADRE II 33650 SAINT MEDARD D'EYRANS France,NONE,NONE,NONE,ZONE ARTISANALE LA PRADE II,NONE,NONE,RUE DES MORILLES,NONE,33650,SAINT MEDARD,FRANCE,NONE,NONE,NONE,ZONE ARTISANALE LE PRADRE II,NONE,NONE,RUE DES MORILLES,NONE,33650,SAINT MEDARD,FRANCE,Match
LINGAT SERVICE TRANSPORTS,CHEMIN DE BELLEVUE 144 08200 GLAIRE France,LINGAT SERVICE TRANSPORTS,CHE DE BELLEVUE ZONE INDUSTRIELLE 08200 GLAIRE France,NONE,NONE,NONE,NONE,NONE,144,CHEMIN DE BELLEVUE,NONE,8200,GLAIRE,FRANCE,NONE,NONE,NONE,ZONE INDUSTRIELLE,NONE,NONE,CHEMIN DE BELLEVUE,NONE,8200,GLAIRE,FRANCE,Match
TAXI CHRONO DE L EST,Z.A. rue Hallingen 57520 Rouhling France,TAXI CHRONO DE L'EST,RUE HALLINGEN 57520 ROUHLING France,NONE,NONE,NONE,ZONE ARTISANALE,NONE,NONE,RUE HALLINGEN,NONE,57520,ROUHLING,FRANCE,NONE,NONE,NONE,NONE,NONE,NONE,RUE HALLINGEN,NONE,57520,ROUHLING,FRANCE,Match
JP TRACTION,8 Rue Serge Closson 08140 DOUZY France,SARL J P TRACTION,15 RUE SERGE CLOSSON 08140 DOUZY France,NONE,NONE,NONE,NONE,NONE,8,RUE SERGE CLOSSON,NONE,8140,DOUZY,FRANCE,NONE,NONE,NONE,NONE,NONE,15,RUE SERGE CLOSSON,NONE,8140,DOUZY,FRANCE,PartialMatch
VITADIS,Avenue du Bisgaret - ZA des Hauts du Val de Nivre 80420 Ville Le Marclet France,VITADIS,AV DU BISGARET ZA DE FLIXECOURT SECTEUR EST 80420 VILLE LE MARCLET France,NONE,NONE,NONE,ZONE ARTISANALE DES HAUTS DU VALLON DE NIVRE,NONE,NONE,AVENUE DU BISGARET,NONE,80420,VILLE,FRANCE,NONE,NONE,NONE,ZONE ARTISANALE DE FLIXECOURT SECTEUR EST 80420 VILLE LE MARCLET FRANCE,NONE,NONE,AVENUE DU BISGARET,NONE,80420,VILLE,FRANCE,Match
ZIEGLER FRANCE 10,10 Rue Antoine Lumire 10600 LA CHAPELLE ST LUC France,ZIEGLER FRANCE SA ZIEGLER FRANCE S A,6 RUE ANTOINE LUMIERE 10600 LA CHAPELLE SAINT LUC France,NONE,NONE,NONE,NONE,NONE,10,RUE ANTOINE LUMIERE,NONE,10600,LA CHAPELLE,FRANCE,NONE,NONE,NONE,NONE,NONE,6,RUE ANTOINE LUMIERE,NONE,10600,LA CHAPELLE,FRANCE,PartialMatch
TRANSPORTS VALLE DU GIROU,88 Route des Platanes - Lagravette 31330 MERVILLE France,TRANSPORTS VALLEE DU GIROU,1992 RTE DES PLATANES LA GRAVETTE 31330 MERVILLE France,NONE,NONE,NONE,NONE,NONE,88,ROUTE DES PLATANES LAGRAVETTE,NONE,31330,MERVILLE,FRANCE,NONE,NONE,NONE,NONE,NONE,1992,ROUTE DES PLATANES LA GRAVETTE,NONE,31330,MERVILLE,FRANCE,PartialMatch
BRUNEEL TRANSPORTS,1 Rue Comte de Bernadotte 56100 LORIENT France,BRUNEEL TRANSPORTS BRUNEEL TRANSPORTS SAS,3 RUE COMTE BERNADOTTE 56100 LORIENT France,NONE,NONE,NONE,NONE,NONE,1,RUE COMTE DE BERNADOTTE,NONE,56100,LORIENT,FRANCE,NONE,NONE,NONE,NONE,NONE,3,RUE COMTE BERNADOTTE,NONE,56100,LORIENT,FRANCE,PartialMatch
GIRONDE SERVI COURSES,Immeuble Aquitaine - rue COPPINGER 33310 LORMONT France," SIVU ""PETITE ENFANCE CENON / LORMONT"" SIGEST MULTI ACCUEILS RAM HTS GIRONDE ",RUE COPPINGER IMMEUBLE VINCENNES 33310 LORMONT France,NONE,IMMEUBLE AQUITAINE,NONE,NONE,NONE,NONE,RUE COPPINGER,NONE,33310,LORMONT,FRANCE,NONE,IMMEUBLE VINCENNES,NONE,NONE,NONE,NONE,RUE COPPINGER,NONE,33310,LORMONT,FRANCE,PartialMatch
TRANSPORTS SOPTRANS,Chemin de la Gazette BP 54 66161 LE BOULOU Cdex France,SOC TRANSPORTS VEHICULES AUTOMOBILES SOC DE TRANSPORTS VEHICULES AUTOMOBILES,CHE DE LA GAZETTE 66160 LE BOULOU France,NONE,NONE,NONE,NONE,NONE,NONE,CHEMIN DE LA GAZETTE,BP 54,66161,LE BOULOU,FRANCE,NONE,NONE,NONE,NONE,NONE,NONE,CHEMIN DE LA GAZETTE,NONE,66160,LE BOULOU,FRANCE,Match
TRANSALDIS,Rue Charles de Coulomb 77290 MITRY MORY France,TRANSALDIS,RUE CHARLES COULOMB ZI DE MITRY COMPANS 77290 MITRY MORY France,NONE,NONE,NONE,NONE,NONE,NONE,RUE CHARLES DE COULOMB,NONE,77290,MITRY MORY,FRANCE,NONE,NONE,NONE,ZONE INDUSTRIELLE DE MITRY COMPARC ACTIVITENS,NONE,NONE,RUE CHARLES COULOMB,NONE,77290,MITRY MORY,FRANCE,Match
FLORCZAK TRANSPORTS,ZI en Petre route de Saramon 32200 GIMONT France,TRANSPORTS FLORCZAK 32 FRANCE EXPRESS,RTE DE SARRAMON 32200 GIMONT France,NONE,NONE,NONE,ZONE INDUSTRIELLE EN PETRE,NONE,NONE,ROUTE DE SARAMON,NONE,32200,GIMONT,FRANCE,NONE,NONE,NONE,NONE,NONE,NONE,ROUTE DE SARRAMON,NONE,32200,GIMONT,FRANCE,Match
GONDRAND FRERES,RUE COMMANDANT COUSTEAU 26800 PORTES LES VALENCE France,SFTGF S.F.T GONDRAND FR\XE8RES,RUE COMMANDANT COUSTEAU LA MOTTE 26800 PORTES LES VALENCE France,NONE,NONE,NONE,NONE,NONE,NONE,RUE COMMANDANT COUSTEAU,NONE,26800,PORTES LES VALENCE,FRANCE,NONE,NONE,NONE,NONE,NONE,NONE,RUE COMMANDANT COUSTEAU LA MOTTE,NONE,26800,PORTES LES VALENCE,FRANCE,Match
SOCIETE DES TRANSPORTS GOUT,route de Saint Pons 11120 SAINT MARCEL SUR AUDE France,EXPLOITATION TRANSPORTS GOUT,RTE DE ST PONS 11120 SAINT MARCEL SUR AUDE France,NONE,NONE,NONE,NONE,NONE,NONE,ROUTE DE SAINT PONS,NONE,11120,SAINT MARCEL SUR AUDE,FRANCE,NONE,NONE,NONE,NONE,NONE,NONE,ROUTE DE SAINT PONS,NONE,11120,SAINT MARCEL SUR AUDE,FRANCE,Match
TRANSECO,1 rue des pins - ZI de la Bicharderie 45400 FLEURY LES AUBRAIS (Orlans-Nord) France,TRANSECO,5 RUE DES PINS ZA DES BICHARDERIES 45400 FLEURY LES AUBRAIS France,NONE,NONE,NONE,ZONE INDUSTRIELLE DE LA BICHARDERIE,NONE,1,RUE DES PINS,NONE,45400,FLEURY,FRANCE,NONE,NONE,NONE,ZONE ARTISANALE DES BICHARDERIES,NONE,5,RUE DES PINS,NONE,45400,FLEURY,FRANCE,PartialMatch
TOUSSAINT,34 Rue Chemin Vert ZI DU CHEMIN VERT 78610 LE PERRAY EN YVELINES France,TRANSPORT TOUSSAINT TRANSPORTS TOUSSAINT,12 RUE DES PINS ZI DU CHEMIN VERT 78610 LE PERRAY EN YVELINES France,NONE,NONE,NONE,ZONE INDUSTRIELLE DU CHEMIN VERT,NONE,34,RUE CHEMIN VERT,NONE,78610,LE PERRAY EN YVELINES,FRANCE,NONE,NONE,NONE,ZONE INDUSTRIELLE DU CHEMIN VERT,NONE,12,RUE DES PINS,NONE,78610,LE PERRAY EN YVELINES,FRANCE,PartialMatch
TRANSPORTS CRANSAC,Puy Laroque 12510 OLEMPS France,TRANSPORTS CRANSAC,LD PUY LAROQUE 12510 OLEMPS France,NONE,NONE,NONE,PUY LAROQUE,NONE,NONE,NONE,NONE,12510,OLEMPS,FRANCE,NONE,NONE,NONE,NONE,NONE,NONE,LIEU DIT PUY LAROQUE,NONE,12510,OLEMPS,FRANCE,PartialMatch
TRANSPORTS JEAN BOURGET,RTE JARCIEU 38270 BEAUREPAIRE France,TRANSPORTS JEAN BOURGET,RTE DE JARCIEU 38270 BEAUREPAIRE France,NONE,NONE,NONE,NONE,NONE,NONE,ROUTE JARCIEU,NONE,38270,BEAUREPAIRE,FRANCE,NONE,NONE,NONE,NONE,NONE,NONE,ROUTE DE JARCIEU,NONE,38270,BEAUREPAIRE,FRANCE,Match
RESEAU COURSIERS,10 rue du Danube 44470 THOUARE SUR LOIRE France,COOPERATIVE RESEAU COURSIERS R\XE9SEAU COURSIERS (COOP\XE9RATIVE R\XE9SEAU COURSIERS),5 RUE DU DANUBE 44470 THOUARE SUR LOIRE France,NONE,NONE,NONE,NONE,NONE,10,RUE DU DANUBE,NONE,44470,THOUARE SUR LOIRE,FRANCE,NONE,NONE,NONE,NONE,NONE,5,RUE DU DANUBE,NONE,44470,THOUARE SUR LOIRE,FRANCE,PartialMatch
AHG TRANSPORT,8 rue Touraine 94460 VALENTON France,A.H.G. TRANSPORT A.H.G.TRANSPORT,6 RUE DE TOURAINE ZAC DES ROSEAUX 94460 VALENTON France,NONE,NONE,NONE,NONE,NONE,8,RUE TOURAINE,NONE,94460,VALENTON,FRANCE,NONE,NONE,NONE,ZONE ARTISANALEC DES ROSEAUX,NONE,6,RUE DE TOURAINE,NONE,94460,VALENTON,FRANCE,PartialMatch
LEBLOND,6 ZA de Braux Avenue des Marguerites 08120 BOGNY SUR MEUSE France,TRANSPORTS LEBLOND,8 AV DES MARGUERITES ZA DE BRAUX 08120 BOGNY SUR MEUSE France,NONE,NONE,NONE,ZONE ARTISANALE DE BRAUX,NONE,6,AVENUE DES MARGUERITES,NONE,8120,BOGNY SUR MEUSE,FRANCE,NONE,NONE,NONE,ZONE ARTISANALE DE BRAUX,NONE,8,AVENUE DES MARGUERITES,NONE,8120,BOGNY SUR MEUSE,FRANCE,PartialMatch
TRANSPORTS BROYER NOLIN,Rue de la Libert 08000 LES AYELLES France,DEMENAGEMENTS NOLIN,RUE DE LA LIBERTE 08000 LES AYVELLES France,NONE,NONE,NONE,NONE,NONE,NONE,RUE DE LA LIBERT,NONE,8000,LES AYELLES,FRANCE,NONE,NONE,NONE,NONE,NONE,NONE,RUE DE LA LIBERTE,NONE,8000,LES AYVELLES,FRANCE,Match
BERNIS CHATEAUROUX,"21, Alle des Maisons Rouges 36008 CHATEAUROUX Cedex France",TRANSPORTS BERNIS,24 ALL DES MAISONS ROUGES 36000 CHATEAUROUX France,NONE,NONE,NONE,NONE,NONE,21,ALLE DES MAISONS ROUGES,NONE,36008,CHATEAUROUX,FRANCE,NONE,NONE,NONE,NONE,NONE,24,ALLEE DES MAISONS ROUGES,NONE,36000,CHATEAUROUX,FRANCE,PartialMatch
TRANSPORTS BOUEIX,Rue Toussaint Catros 33185 LE HAILLAN France,TRANSPORTS BOUEIX SA BOUEIX SAS,RUE TOUSSAINT CATROS 33185 LE HAILLAN France,NONE,NONE,NONE,NONE,NONE,NONE,RUE TOUSSAINT CATROS,NONE,33185,LE HAILLAN,FRANCE,NONE,NONE,NONE,NONE,NONE,NONE,RUE TOUSSAINT CATROS,NONE,33185,LE HAILLAN,FRANCE,Match
CENTRE TRANSPORTS,avenue Chaillot 18100 VIERZON France,SN CENTRE TRANSPORTS,AV DE CHAILLOT CENTRE BERRY LOGISTIQUE 18100 VIERZON France,NONE,NONE,NONE,NONE,NONE,NONE,AVENUE CHAILLOT,NONE,18100,VIERZON,FRANCE,NONE,NONE,NONE,CENTRE BERRY LOGISTIQUE,NONE,NONE,AVENUE DE CHAILLO,NONE,18100,VIERZON,FRANCE,Match
PERES SERVICES,Rue des Cteaux 31240 SAINT JEAN France,PERES SERVICES P\XE9R\XE8S-SERVICES,LES COTEAUX 31240 SAINT JEAN France,NONE,NONE,NONE,NONE,NONE,NONE,RUE LES COTEAUX,NONE,31240,SAINT JEAN,FRANCE,NONE,NONE,NONE,LES COTEAUX,NONE,NONE,NONE,NONE,31240,SAINT JEAN,FRANCE,PartialMatch
T H F,RN 73 Chemin du Gondot 39120 ANNOIRE France,THF SARL,RN 73 39120 ANNOIRE France,NONE,NONE,NONE,NONE,NONE,NONE,ROUTE NATIONALE  73 CHEMIN DU GONDOT,NONE,39120,ANNOIRE,FRANCE,NONE,NONE,NONE,NONE,NONE,NONE,CHEMIN DU GONDOT ROUTE NATIONALE 73,NONE,39120,ANNOIRE,FRANCE,Match
ROGERS I D S,46 Rue Leugenaser 59140 DUNKERQUE France,ROGERS INTERNATIONAL DISTRIBUTION SCES ROGERS INTERNATIONAL DISTRIBUTIONS SERVICES,33 RUE DU LEUGENAR 59140 DUNKERQUE France,NONE,NONE,NONE,NONE,NONE,46,RUE LEUGENASER,NONE,59140,DUNKERQUE,FRANCE,NONE,NONE,NONE,NONE,NONE,33,RUE DU LEUGENAR,NONE,59140,DUNKERQUE,FRANCE,PartialMatch
EXFRET TRANSPORT BARRE,route ancenis 44330 VALLET France,EXFRET 44,RTE D ANCENIS CENT COMM DES DORICES 44330 VALLET France,NONE,NONE,NONE,NONE,NONE,NONE,ROUTE ANCENIS,NONE,44330,VALLET,FRANCE,NONE,NONE,CENTRE COMM DES DORICES,NONE,NONE,NONE,ROUTE D ANCENIS,NONE,44330,VALLET,FRANCE,Match
JOLIVAL,Rue des Mtiers 49340 NUAILLE France,JOLIVAL FRANCE,ZONE INDUSTRIELLE DE LA CAILLE 49340 NUAILLE France,NONE,NONE,NONE,NONE,NONE,NONE,RUE DES MTIERS,NONE,49340,NUAILLE,FRANCE,NONE,NONE,NONE,ZONE INDUSTRIELLE DE LA CAILLE,NONE,NONE,NONE,NONE,49340,NUAILLE,FRANCE,PartialMatch
COMPTOIR LANGUEDOCIEN DE TRANSIT ET MANUTENTION,Quai Rpublique 66660 PORT VENDRES France,CLTM PORT VENDRES COMPT. LANGUED TRANSIT MANUT. PORT VENDRES,QUAI DE LA REPUBLIQUE GARE MARITIME 66660 PORT VENDRES France,NONE,NONE,NONE,NONE,NONE,NONE,QUAI  REPUBLIQUE,NONE,66660,PORT VENDRES,FRANCE,NONE,NONE,GARE MARITIME,NONE,NONE,NONE,QUAI  REPUBLIQUE,NONE,66660,PORT VENDRES,FRANCE,Match
SOMATRANS,Boulevard de l Ile aux Oiseaux 76530 GRAND COURONNE France,SOMATRANS,BD L ILE AUX OISEAUX RVSL 76530 GRAND COURONNE France,NONE,NONE,NONE,NONE,NONE,NONE,BOULEVARD DE L ILE AUX OISEAUX,NONE,76530,GRAND COURONNE,FRANCE,NONE,NONE,NONE,NONE,NONE,NONE,BOULEVARD L ILE AUX OISEAUX,NONE,76530,GRAND COURONNE,FRANCE,Match
EXPRESS SERVICES,ZAC BELL 24 rue CHARLES BOURSEUL 85000 LA ROCHE SUR YON France,EXPRESS SERVICES,11 RUE CHARLES BOURSEUL 85000 LA ROCHE SUR YON France,NONE,NONE,NONE,ZONE ARTISANALEC BELL,NONE,24,RUE CHARLES BOURSEUL,NONE,85000,LA ROCHE SUR YON,FRANCE,NONE,NONE,NONE,NONE,NONE,11,RUE CHARLES BOURSEUL,NONE,85000,LA ROCHE SUR YON,FRANCE,PartialMatch
ATLANTIQUE MONTAGE MOBILIER,Rue des Coteaux DE GESVRES 44119 Treillieres France,ATLANTIQUE MONTAGE MOBILIER A2M ATLANTIQUE MONTAGE MOBILIER,RUE DES COTEAUX DE GESVRES 44119 TREILLIERES France,NONE,NONE,NONE,NONE,NONE,NONE,RUE DES COTEAUX DE GESVRES,NONE,44119,TREILLIERES,FRANCE,NONE,NONE,NONE,NONE,NONE,NONE,RUE DES COTEAUX DE GESVRES,NONE,44119,TREILLIERES,FRANCE,Match
STOCK LOGISTIC,"ZI Roubaix Est, Rue du Trieu du Quesnoy 59115 LEERS France",STOCK STOCK LOGISTIC,RUE TRIEU DE QUESNOY ZI ROUBAIX EST 59115 LEERS France,NONE,NONE,NONE,ZONE INDUSTRIELLE ROUBAIX EST,NONE,NONE,RUE DU TRIEU DU QUESNOY,NONE,59115,LEERS,FRANCE,NONE,NONE,NONE,ZONE INDUSTRIELLE ROUBAIX EST,NONE,NONE,RUE TRIEU DE QUESNOY,NONE,59115,LEERS,FRANCE,Match
BENNES INTERNATIONALES SERVICES,Hameau de la SALVETAT BP 1 81660 PAYRIN - AUGMONTEL France,BENNES INTER SERVICES,HAMEAU DE LA LA SALVETAT 81660 PAYRIN AUGMONTEL France,NONE,NONE,NONE,NONE,NONE,NONE,HAMEAU DE LA SALVETAT,BP 1,81660,PAYRIN AUGMONTEL,FRANCE,NONE,NONE,NONE,NONE,NONE,NONE,HAMEAU DE LA SALVETAT,NONE,81660,PAYRIN AUGMONTEL,FRANCE,Match
PHARMASTOCK,54 Rue du Gros Moulin 45200 AMILLY France,PHARMASTOCK,326 RUE DU GROS MOULIN 45200 AMILLY France,NONE,NONE,NONE,NONE,NONE,54,RUE DU GROS MOULIN,NONE,45200,AMILLY,FRANCE,NONE,NONE,NONE,NONE,NONE,326,RUE DU GROS MOULIN,NONE,45200,AMILLY,FRANCE,PartialMatch
TRANSPORTS AQUITAINE FRANCE,1031 av Georges Clemenceau 33150 CENON France,TRANSPORTS AQUITAINE FRANCE,6 AV GEORGES CLEMENCEAU IMMEUBLE QUERCY 33150 CENON France,NONE,NONE,NONE,NONE,NONE,1031,AVENUE GEORGES CLEMENCEAU,NONE,33150,CENON,FRANCE,NONE,IMMEUBLE QUERCY,NONE,NONE,NONE,6,AVENUE GEORGES CLEMENCEAU,NONE,33150,CENON,FRANCE,PartialMatch
ALBA DEMENAGEMENT 78,88 Rue du Bois Moussay 93240 STAINS France,ALBA DEMENAGEMENTS ALBA D\XE9M\XE9NAGEMENTS INTERNATIONAL,13 RUE DU BOIS MOUSSAY ZAC DU BOIS MOUSSAY 93240 STAINS France,NONE,NONE,NONE,NONE,NONE,88,RUE DU BOIS MOUSSAY,NONE,93240,STAINS,FRANCE,NONE,NONE,NONE,ZONE ARTISANALEC DU BOIS MOUSSAY,NONE,13,RUE DU BOIS MOUSSAY,NONE,93240,STAINS,FRANCE,PartialMatch
