companyI,AddI,CompanyK,AddK,INBUILDING,EXTBUILDING,POILOGISTIC,ZONE,DISTRICT,HOUSENUM,ROADNAME,POBOX,ZIPCODE,CITY,COUNTRY,INBUILDINGK,EXTBUILDINGK,POILOGISTICK,ZONEK,DISTRICTK,HOUSENUMK,ROADNAMEK,POBOXK,ZIPCODEK,CITYK,COUNTRYK,NewLabel
TRANSPORTS DU PERTHOIS,ZI Rue du Bois Guillaume BP 18 51300 MAROLLES France,SA MECANIQUE GENERALE ETS LECLERC SA DE M\XE9CANIQUE G\XE9N\XE9RALE DES ETS LECLERC,11 AV DU PERTHOIS ZI VITRY MAROLLES 51300 MAROLLES France,NONE,NONE,NONE,ZONE INDUSTRIELLE VITRY MAROLLES,NONE,NONE,RUE DU BOIS GUILLAUME,BP 18,51300,MAROLLES,FRANCE,NONE,NONE,NONE,ZONE INDUSTRIELLE VITRY MAROLLES,NONE,11,AVENUE DU PERTHOIS,NONE,51300,MAROLLES,FRANCE,PartialMatch
LE FRT LUZIEN,ZI de Jalday 64500 SAINT JEAN DE LUZ France,CAFE DU CENTRE LUZIEN LE CAFE DU MARCHE,15 AV LABROUCHE LE CAFE DU MARCHE 64500 SAINT JEAN DE LUZ France,NONE,NONE,NONE,ZONE INDUSTRIELLE DE JALDAY,NONE,NONE,NONE,NONE,64500,SAINT JEAN,FRANCE,NONE,NONE,LE CAFE DU MARCHE,NONE,NONE,15,AVENUE LABROUCHE,NONE,64500,SAINT JEAN DE LUZ,FRANCE,NoMatch
TRANSPORTS SOUQUET,ARDICHEN 09230 SOULAN FRANCE,MADAME NATHALIE SOUQUET,HAMEAU DE VILLENEUVE 09320 SOULAN France,NONE,NONE,NONE,ARDICHEN,NONE,NONE,NONE,NONE,9230,SOULAN,FRANCE,NONE,NONE,NONE,NONE,NONE,NONE,HAMEAU DE VILLENEUVE,NONE,9320,SOULAN,FRANCE,NoMatch
TRANSPORTS SOUCASSE LOCATION,6 RUE DE GRENOBLE 31500 TOULOUSE FRANCE,MATRICE MATRICE,15 CHE DU CHAPITRE 31100 TOULOUSE France,NONE,NONE,NONE,NONE,NONE,6,RUE DE GRENOBLE,NONE,31500,TOULOUSE,FRANCE,NONE,NONE,NONE,NONE,NONE,15,CHEMIN DU CHAPITRE,NONE,31100,TOULOUSE,FRANCE,NoMatch
LE FRT LUZIEN,ZI de Jalday 64500 SAINT JEAN DE LUZ France,CENTRE ORTHOPEDIQUE BASQUE LUZIEN,26 CHE CHINGALETENEA 64500 SAINT JEAN DE LUZ France,NONE,NONE,NONE,ZONE INDUSTRIELLE DE JALDAY,NONE,NONE,NONE,NONE,64500,SAINT JEAN DE LUZ,FRANCE,NONE,NONE,NONE,NONE,NONE,26,CHEMIN CHINGALETENEA,NONE,64500,SAINT JEAN DE LUZ,FRANCE,NoMatch
NCT,9 avenue James de Rothschild 77164 FERRIERES EN BRIE France,NCT TRADING,5 AV JOSEPH PAXTON ZAC PARC D'ACTIVITES DU NI 77164 FERRIERES EN BRIE France,NONE,NONE,NONE,NONE,NONE,9,AVENUE JAMES DE ROTHSCHILD,NONE,77164,FERRIERES,FRANCE,NONE,NONE,NONE,ZONE ARTISANALEC PARC ACTIVITERC D'ACTIVITES DU NI,NONE,5,AVENUE JOSEPH PAXTON,NONE,77164,FERRIERES,FRANCE,NoMatch
NCT,9 avenue James de Rothschild 77164 FERRIERES EN BRIE France,N.C.T.,9 RUE JAMES ROTSCHILD 77164 FERRIERES EN BRIE France,NONE,NONE,NONE,NONE,NONE,9,AVENUE JAMES DE ROTHSCHILD,NONE,77164,FERRIERES,FRANCE,NONE,NONE,NONE,NONE,NONE,9,RUE JAMES ROTSCHILD,NONE,77164,FERRIERES,FRANCE,Match
UCT,"8, square Lon Blum 92800 PUTEAUX France",TOUAX RIVER BARGES,100 TERRASSE BOIELDIEU 100 101 TOUR FRANKLIN 23EME ETAGE 92800 PUTEAUX France,NONE,NONE,NONE,NONE,NONE,8,SQUARE LON BLUM,NONE,92800,PUTEAUX,FRANCE,ETAGE,TOUR FRANKLIN 23 EME,NONE,NONE,NONE,100,TERRASSE BOIELDIEU,NONE,92800,PUTEAUX,FRANCE,NoMatch
TRANSPORTS TEILHAC,ZA DU BETONNET 19300 ROSIERS D'EGLETONS FRANCE,TK TRANSPORTS,CHARBES 19300 ROSIERS D'EGLETONS France,NONE,NONE,NONE,ZONE ARTISANALE DU BETONNET,NONE,NONE,NONE,NONE,19300,ROSIERS D'EGLETONS,FRANCE,NONE,NONE,NONE,CHARBES,NONE,NONE,NONE,NONE,19300,ROSIERS D'EGLETONS,FRANCE,NoMatch
TRANSPORTS ARCHER,ZI St germain Laprade 43700 SAINT GERMAIN LAPRADE France,FINANCIERE ARCHER-FINAR,ZI BLAVOZY ST GERMAIN LAPR 43700 SAINT GERMAIN LAPRADE France,NONE,NONE,NONE,ZONE INDUSTRIELLE BLAVOZY,NONE,NONE,NONE,NONE,43700,SAINT GERMAIN,FRANCE,NONE,NONE,NONE,ZONE INDUSTRIELLE BLAVOZY,NONE,NONE,NONE,NONE,43700,SAINT GERMAIN,FRANCE,Match
TRANSPORTS VIDAL,RUE DU PONT VIEUX 81240 SAINT AMANS SOULT FRANCE,ROCHER - FRATTINI TRANSPORTS,LD GRAZAC ANCIENNE ROUTE DU PUY 43320 SAINT VIDAL France,NONE,NONE,NONE,NONE,NONE,NONE,RUE DU PONT VIEUX,NONE,81240,SAINT,FRANCE,NONE,NONE,NONE,NONE,NONE,NONE,LIEU DIT GRAZAC ANCIENNE ROUTE DU PUY,NONE,43320,SAINT,FRANCE,NoMatch
TRANSPORTS GALIBERT,LIEU-DIT 12630 AGEN D'AVEYRON FRANCE,TRANSPORTS GALIBERT,LE BOURG 12630 AGEN D'AVEYRON France,NONE,NONE,NONE,NONE,NONE,NONE,LIEU DIT,NONE,12630,AGEN,FRANCE,NONE,NONE,NONE,LE BOURG,NONE,NONE,NONE,NONE,12630,AGEN,FRANCE,NoMatch
LM TRANS FRET,7 impasse du Pradi - ZI Lou Verda 31270 Villeneuve Tolosane France,L.M-TRANS-FRET,5 RUE ECOPOLE ZA ECOPOLE 31270 VILLENEUVE TOLOSANE France,NONE,NONE,NONE,ZONE INDUSTRIELLE LOU VERDA,NONE,7,IMPASSE DU PRADI,NONE,31270,VILLENEUVE TOLOSANE,FRANCE,NONE,NONE,NONE,ZONE ARTISANALE ECOPOLE,NONE,5,RUE ECOPOLE,NONE,31270,VILLENEUVE TOLOSANE,FRANCE,NoMatch
LEA LOGISTIQUE,ALLEE PAUL MARQUILLANES 66034 66034 Perpignan France,LEA FRESH,RUE D'ALMERIA GRAND SAINT CHARLES 66000 PERPIGNAN France,NONE,NONE,NONE,NONE,NONE,NONE,ALLEE PAUL MARQUILLANES,NONE,66034,PERPIGNAN,FRANCE,NONE,NONE,NONE,NONE,NONE,NONE,RUE D'ALMERIA,NONE,66000,PERPIGNAN,FRANCE,NoMatch
GEFCO BRUGES,Rue de Strasbourg 33520 BRUGES France,GEFCO SA,AVENUE DE STRASBOURG ZONE INDUSTRIELLE DE BORDEAUX FRET 33520 BRUGES France,NONE,NONE,NONE,NONE,NONE,NONE,RUE DE STRASBOURG,NONE,33520,BRUGES,FRANCE,NONE,NONE,NONE,ZONE INDUSTRIELLE DE BORDEAUX FRET,NONE,NONE,AVENUE DE STRASBOURG,NONE,33520,BRUGES,FRANCE,Match
EST-OUEST TRANSPORTS,"68, AVENUE SAINT EXUPERY 13800 ISTRES FRANCE",REGIE CULTURELLE OUEST PROVENCE SC\XE8NES ET CIN\XE9S,9 PL DES CARMES 13800 ISTRES France,NONE,NONE,NONE,NONE,NONE,68,AVENUE SAINT EXUPERY,NONE,13800,ISTRES,FRANCE,NONE,NONE,NONE,NONE,NONE,9,PLACE DES CARMES,NONE,13800,ISTRES,FRANCE,NoMatch
TRANSPORTS ACHILLE,15 RUE AU MAIRE 75003 PARIS FRANCE,ACHILLE,26 AVENUE CLAUDE VELLEFAUX 75010 PARIS 10 France,NONE,NONE,NONE,NONE,NONE,15,RUE AU MAIRE,NONE,75003,PARIS,FRANCE,NONE,NONE,NONE,NONE,NONE,26,AVENUE CLAUDE VELLEFAUX,NONE,75010,PARIS,FRANCE,NoMatch
TRANSPORTS RIGAL,73 rue Simone Trouche 81400 BLAYE-LES-MINES France,J-P RIGAL SAS JEAN-PIERRE RIGAL,BELLEVUE 81400 BLAYE LES MINES France,NONE,NONE,NONE,NONE,NONE,73,RUE SIMONE TROUCHE,NONE,81400,BLAYE,FRANCE,NONE,NONE,NONE,BELLEVUE,NONE,NONE,NONE,NONE,81400,BLAYE,FRANCE,NoMatch
TRANSPORTS RIGAL,73 rue Simone Trouche 81400 BLAYE-LES-MINES France,MME MARIE THERESE CASTANIE TAXI DU CEROU,3 AV DE MONESTIES 81400 BLAYE LES MINES France,NONE,NONE,NONE,NONE,NONE,73,RUE SIMONE TROUCHE,NONE,81400,BLAYE,FRANCE,NONE,NONE,NONE,NONE,NONE,3,AVENUE DE MONESTIES,NONE,81400,BLAYE,FRANCE,NoMatch
MTM MESSAGERIE TRANIER MONTAUBAN,ZI de Moulis - 300 Impasse Prat de Valat 82710 BRESSOLS France,SENGES 82 SENGES 82,ZONE INDUSTRIELLE MOULIS 82710 BRESSOLS France,NONE,NONE,NONE,ZONE INDUSTRIELLE DE MOULIS,NONE,300,IMPASSE PRAT DE VALAT,NONE,82710,BRESSOLS,FRANCE,NONE,NONE,NONE,ZONE INDUSTRIELLE MOULIS,NONE,NONE,NONE,NONE,82710,BRESSOLS,FRANCE,PartialMatch
AUBRY,6 RUE DE L'ETANG 52500 POINSON LES FAYL FRANCE,AUBRY AUBRY,2 CHE DE CHARMONT 52500 POINSON LES FAYL France,NONE,NONE,NONE,NONE,NONE,6,RUE DE L'ETANG,NONE,52500,POINSON LES FAYL,FRANCE,NONE,NONE,NONE,NONE,NONE,2,CHEMIN DE CHARMONT,NONE,52500,POINSON LES FAYL,FRANCE,NoMatch
TRANSPORTS CUSMAN MARC,1578 QUARTIER BEAUCHAMPS 83400 HYERES FRANCE,SARL TRANSPORTS CUSMAN,1578 BEAUCHAMP RTE DE NICE 83400 HYERES France,NONE,NONE,NONE,QUARTIER BEAUCHAMPS,NONE,NONE,NONE,NONE,83400,HYERES,FRANCE,NONE,NONE,NONE,BEAUCHAMP,NONE,NONE,ROUTE DE NICE,NONE,83400,HYERES,FRANCE,PartialMatch
ACTIONS SERVICES TRANSPORTS,41/51 Rue Jacquard 77400 LAGNY SUR MARNE France,AVL,30 AV CHARLES INFROIS 77400 LAGNY SUR MARNE France,NONE,NONE,NONE,NONE,NONE,41/51,RUE JACQUARD,NONE,77400,LAGNY,FRANCE,NONE,NONE,NONE,NONE,NONE,30,AVENUE CHARLES INFROIS,NONE,77400,LAGNY,FRANCE,NoMatch
CREUSE TRANSPORTS,6 RUE DU PR PIQUET 23400 BOURGANEUF FRANCE,COMMUNE DE BOURGANEUF ECOLE PRIMAIRE MARTIN NADAUD,AV DU TRIBUNAL 23400 BOURGANEUF France,NONE,NONE,NONE,NONE,NONE,6,RUE DU PR PIQUET,NONE,23400,BOURGANEUF,FRANCE,NONE,NONE,NONE,NONE,NONE,NONE,AVENUE DU TRIBUNAL,NONE,23400,BOURGANEUF,FRANCE,NoMatch
CREUSE TRANSPORTS,6 RUE DU PR PIQUET 23400 BOURGANEUF FRANCE,GASPAR ET FILS,8 B RTE DE REGEASSE 23400 BOURGANEUF France,NONE,NONE,NONE,NONE,NONE,6,RUE DU PR PIQUET,NONE,23400,BOURGANEUF,FRANCE,NONE,NONE,NONE,NONE,NONE,8 B,ROUTE DE REGEASSE,NONE,23400,BOURGANEUF,FRANCE,NoMatch
TRANSPORTS COPEL,8 rue de l'industrie 08400 VOUZIERS France,COPEL ET ASSOCIES,8 RUE DE L INDUSTRIE 08400 VOUZIERS France,NONE,NONE,NONE,NONE,NONE,8,RUE DE L'INDUSTRIE,NONE,8400,VOUZIERS,FRANCE,NONE,NONE,NONE,NONE,NONE,8,RUE DE L INDUSTRIE,NONE,8400,VOUZIERS,FRANCE,Match
PARTNER TRANSPORT,ZA CDG - 6 Rue Mermoz 93297 TREMBLAY EN FRANCE CEDEX France,AIRPORT HANDLING PARTNER,4 PL DE BERLIN BAT NEPTUNE 93290 TREMBLAY EN FRANCE France,NONE,NONE,NONE,ZONE ARTISANALE CDG,NONE,6,RUE MERMOZ,NONE,93297,TREMBLAY EN,FRANCE,NONE,BATIMENT NEPTUNE FRANCE,NONE,NONE,NONE,4,PLACE DE BERLIN,NONE,93290,TREMBLAY EN,FRANCE,NoMatch
TLP,1 RUE DES PRES PECATES 88580 SAULCY SUR MEURTHE FRANCE,M XAVIER CLAUDEPIERRE,29 RUE DES ECOLES 88580 SAULCY SUR MEURTHE France,NONE,NONE,NONE,NONE,NONE,1,RUE DES PRES PECATES,NONE,88580,SAULCY,FRANCE,NONE,NONE,NONE,NONE,NONE,29,RUE DES ECOLES,NONE,88580,SAULCY,FRANCE,NoMatch
TRANSPORTS BOSSOUTROT,FOIRAIL 19700 LAGRAULIERE FRANCE,TRANSPORTS BOSSOUTROT,LE CHAMP DE FOIRE 19700 LAGRAULIERE France,NONE,NONE,NONE,FOIRAIL,NONE,NONE,NONE,NONE,19700,LAGRAULIERE,FRANCE,NONE,NONE,NONE,LE CHAMP DE FOIRE,NONE,NONE,NONE,NONE,19700,LAGRAULIERE,FRANCE,NoMatch
BBL SHIPPING,162 boulevard Danielle Casanova 13014 MARSEILLE France,BBL SHIPPING BBL TRANSPORT,450 CHE DU LITTORAL 13016 MARSEILLE 16 France,NONE,NONE,NONE,NONE,NONE,162,BOULEVARD DANIELLE CASANOVA,NONE,13014,MARSEILLE,FRANCE,NONE,NONE,NONE,NONE,NONE,450,CHEMIN DU LITTORAL,NONE,13016,MARSEILLE,FRANCE,NoMatch
TRANSPORTS ETCHEVERRIA,45 AVENUE D'ANGLET 64200 BIARRITZ FRANCE,MONSIEUR BAPTISTE ECHEVERRIA,41 AVENUE DE COULAOUN HLM PARME BATIMENT C 64200 BIARRITZ France,NONE,NONE,NONE,NONE,NONE,45,AVENUE D'ANGLET,NONE,64200,BIARRITZ,FRANCE,NONE,BATIMENT C,NONE,NONE,NONE,41,AVENUE DE COULAOUN HLM PARME,NONE,64200,BIARRITZ,FRANCE,NoMatch
TRANSPORTS TRANSGUY,avenue du 8 Mai 1945 30700 UZES France,SARL TRANSGUY,PONT DES CHARRETTES ZAM 30700 UZES France,NONE,NONE,NONE,NONE,NONE,8,AVENUE DU   MAI 1945,NONE,30700,UZES,FRANCE,NONE,NONE,NONE,PONT DES CHARRETTES ZONE ARTISANALEM,NONE,NONE,NONE,NONE,30700,UZES,FRANCE,NoMatch
TRANSPORTS SZCZYRBA,50 RUE JEAN MOULIN 10450 BREVIANDES FRANCE,TRANSPORTS SZCZYRBA,4 RUE RAOUL FOLLEREAU ZA DU COULMET 10450 BREVIANDES France,NONE,NONE,NONE,NONE,NONE,50,RUE JEAN MOULIN,NONE,10450,BREVIANDES,FRANCE,NONE,NONE,NONE,ZONE ARTISANALE DU COULMET,NONE,4,RUE RAOUL FOLLEREAU,NONE,10450,BREVIANDES,FRANCE,NoMatch
BOIS D'AUVERGNE TRANSPORT,ZI GOURNIER 26200 MONTELIMAR FRANCE,T D S E,ROUTE DE SAINT PAUL 26200 MONTELIMAR France,NONE,NONE,NONE,ZONE INDUSTRIELLE GOURNIER,NONE,NONE,NONE,NONE,26200,MONTELIMAR,FRANCE,NONE,NONE,NONE,NONE,NONE,NONE,ROUTE DE SAINT PAUL,NONE,26200,MONTELIMAR,FRANCE,NoMatch
BOIS D'AUVERGNE TRANSPORT,ZI GOURNIER 26200 MONTELIMAR FRANCE,TRANSPORTS BOIS D AUVERGNE,CHE DE FORTUNO ZI SUD 26200 MONTELIMAR France,NONE,NONE,NONE,ZONE INDUSTRIELLE GOURNIER,NONE,NONE,NONE,NONE,26200,MONTELIMAR,FRANCE,NONE,NONE,NONE,ZONE INDUSTRIELLE SUD,NONE,NONE,CHEMIN DE FORTUNO,NONE,26200,MONTELIMAR,FRANCE,NoMatch
TRANSPORTS SOUQUET,ARDICHEN 09230 SOULAN FRANCE,MADAME NATHALIE SOUQUET,HAMEAU DE VILLENEUVE 09320 SOULAN France,NONE,NONE,NONE,ARDICHEN,NONE,NONE,NONE,NONE,9230,SOULAN,FRANCE,NONE,NONE,NONE,NONE,NONE,NONE,HAMEAU DE VILLENEUVE,NONE,9320,SOULAN,FRANCE,NoMatch
LE ROY,3 rue des Alpes 69120 VAULX EN VELIN France,TACOS ROY TACOS AVENUE,2 RUE JACQUARD POLE DE LOISIRS ET DE COM CARRE DE SOI 69120 VAULX EN VELIN France,NONE,NONE,NONE,NONE,NONE,3,RUE DES ALPES,NONE,69120,VAULX EN VELIN,FRANCE,NONE,NONE,NONE,NONE,NONE,2,RUE JACQUARD,NONE,69120,VAULX EN VELIN,FRANCE,NoMatch
SOCIETE NOUVELLE CHEVALIER ET COMPAGNIE,Route de Langres 52200 ST VALLIER SUR MARNE France,SOCIETE NOUVELLE CHEVALIER COMPAGNIE SOCIETE NOUVELLE CHEVALIER ET COMPAGNIE,RUE JACQUARD 52200 SAINT VALLIER SUR MARNE France,NONE,NONE,NONE,NONE,NONE,NONE,ROUTE DE LANGRES,NONE,52200,SAINT VALLIER,FRANCE,NONE,NONE,NONE,NONE,NONE,NONE,RUE JACQUARD,NONE,52200,SAINT VALLIER,FRANCE,NoMatch
LOCABEN,LOCABEN SARL 30320 MARGUERITTES FRANCE,LOCABEN SARL,18 RUE DES LAVANDIERES 30320 MARGUERITTES France,NONE,NONE,NONE,LOCABEN SARL,NONE,NONE,NONE,NONE,30320,MARGUERITTES,FRANCE,NONE,NONE,NONE,NONE,NONE,18,RUE DES LAVANDIERES,NONE,30320,MARGUERITTES,FRANCE,NoMatch
DISTRICOLIS,18 route de la Justice 05000 GAP France,DISTRICOLIS 04,92 AVENUE D EMBRUN 05000 GAP France,NONE,NONE,NONE,NONE,NONE,18,ROUTE DE LA JUSTICE,NONE,5000,GAP,FRANCE,NONE,NONE,NONE,NONE,NONE,92,AVENUE D EMBRUN,NONE,5000,GAP,FRANCE,NoMatch
FRET CARGO INTERNATIONAL,"30, RUE DU BALLON 93160 NOISY-LE-GRAND FRANCE",M NGOUAMA JORIS MICHEL N'GOMA,5 ALL FERNAND LEGER 93160 NOISY LE GRAND France,NONE,NONE,NONE,NONE,NONE,30,RUE DU BALLON,NONE,93160,NOISY LE GRAND,FRANCE,NONE,NONE,NONE,NONE,NONE,5,ALLEE FERNAND LEGER,NONE,93160,NOISY LE GRAND,FRANCE,NoMatch
TRANSPORTS GLENISSON FRRES,rue du Triage 95100 ARGENTEUIL France,TRANSPORTS GLENISSON FRERES,GARE D ARGENTEUIL BATIMENT LE KID 95100 ARGENTEUIL France,NONE,NONE,NONE,NONE,NONE,NONE,RUE DU TRIAGE,NONE,95100,ARGENTEUIL,FRANCE,NONE,BATIMENT LE KID,GARE D ARGENTEUIL,NONE,NONE,NONE,NONE,NONE,95100,ARGENTEUIL,FRANCE,NoMatch
MARCELLIN ET CIE,21 Avenue Jean Jaurs BP 30 05000 GAP France,MARCELLIN ET COMPAGNIE AUX GENTLEMAN DU D\XE9M\XE9NAGEMENT,LA PLAINE DE LACHAUP 05000 GAP France,NONE,NONE,NONE,NONE,NONE,21,AVENUE JEAN JAURS,BP 30,5000,GAP,FRANCE,NONE,NONE,NONE,LA PLAINE DE LACHAUP,NONE,NONE,NONE,NONE,5000,GAP,FRANCE,NoMatch
MARCELLIN ET CIE,21 Avenue Jean Jaurs BP 30 05000 GAP France,CHEZ NGUYEN,4 PL JEAN MARCELLIN 05000 GAP France,NONE,NONE,NONE,NONE,NONE,21,AVENUE JEAN JAURS,BP 30,5000,GAP,FRANCE,NONE,NONE,NONE,NONE,NONE,4,PLACE JEAN MARCELLIN,NONE,5000,GAP,FRANCE,NoMatch
TRANSPORTS MANUTENTION COUTURIER,155 rue de Fontenailles 71000 MACON France,TRANSPORTS - MANUTENTION COUTURIER,325 RUE DES FRERES LUMIERE 71000 MACON France,NONE,NONE,NONE,NONE,NONE,155,RUE DE FONTENAILLES,NONE,71000,MACON,FRANCE,NONE,NONE,NONE,NONE,NONE,325,RUE DES FRERES LUMIERE,NONE,71000,MACON,FRANCE,NoMatch
TRANSPORTS DIGOINNAIS,rue Blattiers 71160 DIGOIN France,TRANSPORTS DIGOINNAIS,ESPACE INDUSTRIEL LES MURIERS 71160 DIGOIN France,NONE,NONE,NONE,NONE,NONE,NONE,RUE BLATTIERS,NONE,71160,DIGOIN,FRANCE,NONE,NONE,NONE,ESPARC ACTIVITECE INDUSTRIEL LES MURIERS,NONE,NONE,NONE,NONE,71160,DIGOIN,FRANCE,NoMatch
TRANSPORTS TRANSGUY,avenue du 8 Mai 1945 30700 UZES France,SOC UZETIENNE DE TRANSPORTS VIALAT SA UZETIENNE DE TRANSPORTS VIALAT SA,MAS DE MEZE 30700 UZES France,NONE,NONE,NONE,NONE,NONE,NONE,AVENUE DU 8 MAI 1945,NONE,30700,UZES,FRANCE,NONE,NONE,NONE,MAS DE MEZE,NONE,NONE,NONE,NONE,30700,UZES,FRANCE,NoMatch
TRANSPORTS GRENIE,Zi Saint Etienne - chemin de Cazenave 64100 BAYONNE France,MME EMILIE GRENIER,2 AV DU PRISSE L'ORANGERIE 64100 BAYONNE France,NONE,NONE,NONE,ZONE INDUSTRIELLE SAINT ETIENNE,NONE,NONE,CHEMIN DE CAZENAVE,NONE,64100,BAYONNE,FRANCE,NONE,NONE,NONE,NONE,NONE,2,AVENUE DU PRISSE L'ORANGERIE,NONE,64100,BAYONNE,FRANCE,NoMatch
AUBIN TRANSPORTS SA,Hameau Bisrue 76340 ST VICTOR D'YMONVILLE France,TRANSPORTS AUBIN,PARC DU HODE LOTISSEMENT DES VANNEAUX 76430 SAINT VIGOR D'YMONVILLE France,NONE,NONE,NONE,NONE,NONE,NONE,HAMEAU BIS RUE,NONE,76340,SAINT VICTOR,FRANCE,NONE,LOTISSEMENT DES VANNEAUX,NONE,PARC ACTIVITERC DU HODE,NONE,NONE,NONE,NONE,76430,SAINT VIGOR,FRANCE,NoMatch
CALBERSON 30 NIMES,Zac de Grzan 691 avenue Frdric Bartholdi 30034 NIMES Cedex France,LOGIDIS CARREFOUR,335 RUE SOUFFLOT ZONE INDUSTRIELLE DE GREZAN 30000 NIMES France,NONE,NONE,NONE,ZONE ARTISANALEC DE GRZONE ARTISANALEN,NONE,691,AVENUE FRDRIC BARTHOLDI,NONE,30034,NIMES,FRANCE,NONE,NONE,NONE,ZONE INDUSTRIELLE DE GREZONE ARTISANALEN,NONE,335,RUE SOUFFLOT,NONE,30000,NIMES,FRANCE,NoMatch
TRANSPORTS DANIEL FERON,31 rue de la Tuillerie 10700 POUAN LES VALLES France,M DANIEL FERON,RUE SOUFFLOT  10700 POUAN LES VALLEES France,NONE,NONE,NONE,NONE,NONE,31,RUE DE LA TUILLERIE,NONE,10700,POUAN LES VALLES,FRANCE,NONE,NONE,NONE,NONE,NONE,NONE,RUE SOUFFLOT,NONE,10700,POUAN LES VALLEES,FRANCE,NoMatch
BRAY TRANSPORTS,1702 Rue de la VOYE GRARD 62680 MERICOURT France,FOOTBALL CLUB E BRAY TRANSPORT,18 RUE DE L EGALITE 62680 MERICOURT France,NONE,NONE,NONE,NONE,NONE,1702,RUE DE LA VOYE GRARD,NONE,62680,MERICOURT,FRANCE,NONE,NONE,NONE,NONE,NONE,18,RUE DE L EGALITE,NONE,62680,MERICOURT,FRANCE,NoMatch
TRANSPORTS R. BLANCHET,Les Tuileries 36400 VERNEUIL SUR IGNERAIE France,R. BLANCHET TRANSPORTS R. BLANCHET,IMP LES TUILERIES 36400 VERNEUIL SUR IGNERAIE France,NONE,NONE,NONE,LES TUILERIES,NONE,NONE,NONE,NONE,36400,VERNEUIL,FRANCE,NONE,NONE,NONE,NONE,NONE,NONE,IMPASSE LES TUILERIES,NONE,36400,VERNEUIL,FRANCE,PartialMatch
TRANSPORTS SAFTER,Zone Saint Charles BP 20 66011 PERPIGNAN France,SATFER FRANCE,119 RUE DE PROVENCE MARCHE INTER ST CHARLES 119 125 66000 PERPIGNAN France,NONE,NONE,NONE,ZONE SAINT CHARLES,NONE,NONE,NONE,BP 20,66011,PERPIGNAN,FRANCE,NONE,NONE,NONE,NONE,NONE,119,RUE DE PROVENCE,NONE,66000,PERPIGNAN,FRANCE,NoMatch
TRANSPORTS SAFTER,Zone Saint Charles BP 20 66011 PERPIGNAN France,SATFER FRANCE,119 RUE DE PROVENCE 66000 PERPIGNAN France,NONE,NONE,NONE,ZONE SAINT CHARLES,NONE,NONE,NONE,BP 20,66011,PERPIGNAN,FRANCE,NONE,NONE,NONE,NONE,NONE,119,RUE DE PROVENCE,NONE,66000,PERPIGNAN,FRANCE,NoMatch
SAVERNE TRANSPORTS,Rue Rohan 67790 STEINBOURG France,CARS DES ROHAN,RTE DE SAVERNE PARC D'ACTIVITES 67790 STEINBOURG France,NONE,NONE,NONE,NONE,NONE,NONE,RUE ROHAN,NONE,67790,STEINBOURG,FRANCE,NONE,NONE,NONE,PARC ACTIVITERC D'ACTIVITES,NONE,NONE,ROUTE DE SAVERNE,NONE,67790,STEINBOURG,FRANCE,NoMatch
TRANSPORTS SAINT-JEAN,ZI Jean Malze - 46 rue Denis Papin 47420 BON ENCONTRE France,SFTGF SOC FRANCAISE TRANSPORTS GONDRAND FRERES - SFT GONDRAND FR,18 RUE LOUIS ARMAND 47240 BON ENCONTRE France,NONE,NONE,NONE,ZONE INDUSTRIELLE JEAN MALZE,NONE,46,RUE DENIS PAPIN,NONE,47420,BON ENCONTRE,FRANCE,NONE,NONE,NONE,NONE,NONE,18,RUE LOUIS ARMAND,NONE,47240,BON ENCONTRE,FRANCE,NoMatch
TRANSPORTS GIACOMIN ET FILS,2617 av St Sever 40280 SAINT PIERRE DU MONT France,GIACOMIN ET FILS,ZA DE PELLAGAS RTE DE ST SEVER 40280 SAINT PIERRE DU MONT France,NONE,NONE,NONE,NONE,NONE,2617,AVENUE SAINT SEVER,NONE,40280,SAINT PIERRE,FRANCE,NONE,NONE,NONE,ZONE ARTISANALE DE PELLAGAS,NONE,NONE,ROUTE DE SAINT SEVER,NONE,40280,SAINT PIERRE,FRANCE,PartialMatch
STEF TRANSPORT BORDEAUX,Rue du Lugan Zi de Tartifume 33130 BEGLES France,STEF INTERNATIONAL BORDEAUX,3 RUE DU LUGAN ZI DE TARTIFUME 33130 BEGLES France,NONE,NONE,NONE,ZONE INDUSTRIELLE DE TARTIFUME,NONE,5,RUE DU LUGAN,NONE,33130,BEGLES,FRANCE,NONE,NONE,NONE,ZONE INDUSTRIELLE DE TARTIFUME,NONE,3,RUE DU LUGAN,NONE,33130,BEGLES,FRANCE,PartialMatch
DERET TRANSPORTEUR,331 ANCIENNE ROUTE de CHARTRES 45770 SARAN France,DERET TRANSPORTEUR,1459 RTE D ORMES 45770 SARAN France,NONE,NONE,NONE,NONE,NONE,NONE,ROUTE DE CHARTRES,NONE,45770,SARAN,FRANCE,NONE,NONE,NONE,NONE,NONE,1459,ROUTE D ORMES,NONE,45770,SARAN,FRANCE,NoMatch
DERET TRANSPORTEUR,331 ANCIENNE ROUTE de CHARTRES 45770 SARAN France,DERET LOGISTIQUE,580 RUE DU CHAMP ROUGE ZAC DES VERGERS 45770 SARAN France,NONE,NONE,NONE,NONE,NONE,331,ANCIENNE ROUTE DE CHARTRES,NONE,45770,SARAN,FRANCE,NONE,NONE,NONE,ZONE ARTISANALEC DES VERGERS,NONE,580,RUE DU CHAMP ROUGE,NONE,45770,SARAN,FRANCE,NoMatch
MORIN LOGISTIC,14 impasse du Roussillon 38070 SAINT QUENTIN FALLAVIER France,MORIN LOGISTIC,26 RUE DES CHAPELLES 26 40 38070 SAINT QUENTIN FALLAVIER France,NONE,NONE,NONE,NONE,NONE,14,IMPASSE DU ROUSSILLON,NONE,38070,SAINT QUENTIN,FRANCE,NONE,NONE,NONE,NONE,NONE,26,RUE DES CHAPELLES,NONE,38070,SAINT QUENTIN,FRANCE,NoMatch
DHL 75 - DANZAS 75 PARIS 2,23 rue Feydeau 75002 PARIS France,DHL INTERNATIONAL EXPRESS FRANCE,189 RUE D AUBERVILLIERS 75018 PARIS 18 France,NONE,NONE,NONE,NONE,NONE,23,RUE FEYDEAU,NONE,75002,PARIS,FRANCE,NONE,NONE,NONE,NONE,NONE,189,RUE D AUBERVILLIERS,NONE,75018,PARIS,FRANCE,NoMatch
OVALIE TRANSPORTS,"ZI Croix Sud - 1, avenue du Forum 11100 NARBONNE France",OVALIE FINANCE,1 BD GAMBETTA 11100 NARBONNE France,NONE,NONE,NONE,ZONE INDUSTRIELLE CROIX SUD,NONE,1,AVENUE DU FORUM,NONE,11100,NARBONNE,FRANCE,NONE,NONE,NONE,NONE,NONE,1,BOULEVARD GAMBETTA,NONE,11100,NARBONNE,FRANCE,NoMatch
AXE LOGISTICS,300 Rue Alexandre Richetta 69400 69400 VILLEFRANCHE SUR SAONE France,AXE LOGISTICS,138 RUE PHILIPPE HERON 69400 VILLEFRANCHE SUR SAONE France,NONE,NONE,NONE,NONE,NONE,300,RUE ALEXANDRE RICHETTA,NONE,69400,VILLEFRANCHE,FRANCE,NONE,NONE,NONE,NONE,NONE,138,RUE PHILIPPE HERON,NONE,69400,VILLEFRANCHE,FRANCE,NoMatch
VOS LOGISTICS BRETAGNE,parc Activite D 35370 ETRELLES France,THALES DMS FRANCE SAS,ZA PIQUET CAP BRETAGNE 35370 ETRELLES France,NONE,NONE,NONE,PARC ACTIVITE D,NONE,NONE,NONE,NONE,35370,ETRELLES,FRANCE,NONE,NONE,NONE,ZONE ARTISANALE PIQUET CAP BRETAGNE,NONE,NONE,NONE,NONE,35370,ETRELLES,FRANCE,NoMatch
TRANSPORTS ARCHEREAU,9 Rue de la Haie Arrt 08000 PRIX LES MEZIERES France,TRANSPORTS ARCHEREAU,42 RUE DU STADE 08000 PRIX LES MEZIERES France,NONE,NONE,NONE,NONE,NONE,9,RUE DE LA HAIE ARRT,NONE,8000,PRIX LES MEZIERES,FRANCE,NONE,NONE,NONE,NONE,NONE,42,RUE DU STADE,NONE,8000,PRIX LES MEZIERES,FRANCE,NoMatch
TRANSPORTS VIGNERON,1135 rue Lavoisier 54710 LUDRES France,VIGNERON LOGISTIQUE,1120 RUE LAVOISIER 54710 LUDRES France,NONE,NONE,NONE,NONE,NONE,1135,RUE LAVOISIER,NONE,54710,LUDRES,FRANCE,NONE,NONE,NONE,NONE,NONE,1120,RUE LAVOISIER,NONE,54710,LUDRES,FRANCE,PartialMatch
SA TRANSPORTS LEROY,ZI Galance 62430 SALLAUMINES France,SA DES TRANSPORTS LEROY TRANSPORTS LEROY,RUE DU MARAIS PARC ACTIVITES GALANCE 62430 SALLAUMINES France,NONE,NONE,NONE,ZONE INDUSTRIELLE GALANCE,NONE,NONE,NONE,NONE,62430,SALLAUMINES,FRANCE,NONE,NONE,NONE,PARC ACTIVITE GALANCE,NONE,NONE,RUE DU MARAIS,NONE,62430,SALLAUMINES,FRANCE,PartialMatch
MATHEZ TRANSPORTS INTERNATIONAUX,Aroport Nice Cote d'Azur Terminal Cargo CS 5310 06202 NICE CEDEX 3 France,MATHEZ TRANSPORTS INTERNATIONAUX MATHEZ TRANSPORTS INTERNATIONAUX S.A.,AV EMMANUEL PONTREMOLI NICE LA PLAINE BAT C2 06200 NICE France,NONE,NONE,AROPORT NICE COTE D'AZUR TERMINAL CARGO,NONE,NONE,NONE,NONE,NONE,6202,NICE,FRANCE,NONE,BATIMENT C2,NONE,NONE,NONE,NONE,AVENUE EMMANUEL PONTREMOLI NICE LA PLAINE,NONE,6200,NICE,FRANCE,NoMatch
HEMMERLIN,12 Rue des Cevennes 68390 SAUSHEIM France,MONSIEUR PIERRE HEMMERLIN,RUE NEUVE 68390 SAUSHEIM France,NONE,NONE,NONE,NONE,NONE,12,RUE DES CEVENNES,NONE,68390,SAUSHEIM,FRANCE,NONE,NONE,NONE,NONE,NONE,NONE,RUE NEUVE,NONE,68390,SAUSHEIM,FRANCE,NoMatch
CHALLENGE INTERNATIONAL,2 rue Vincent Van Gogh BP69 76290 MONTIVILLIERS France,XP LOG CHALLENGE,2 RUE VINCENT VAN GOGH 76290 MONTIVILLIERS France,NONE,NONE,NONE,NONE,NONE,2,RUE VINCENT VAN GOGH,BP 69,76290,MONTIVILLIERS,FRANCE,NONE,NONE,NONE,NONE,NONE,2,RUE VINCENT VAN GOGH,NONE,76290,MONTIVILLIERS,FRANCE,Match
MORCELLIN TRANSPORTS,RN 92 21 38160 CHATTE France,PETANQUODROME PAYS SAINT-MARCELLIN PETANQUODROME DU PAYS DE SAINT-MARCELLIN,2420 RTE DE ROMANS 38160 CHATTE France,NONE,NONE,NONE,NONE,NONE,NONE,ROUTE NATIONALE 92,NONE,38160,CHATTE,FRANCE,NONE,NONE,NONE,NONE,NONE,2420,ROUTE DE ROMANS,NONE,38160,CHATTE,FRANCE,NoMatch
PERROCHEAU ET FILS,ZI ROUSSILLON 44650 LEGE France,TRANSPORTS PERROCHEAU ET FILS,2 RUE DU ROUSSILLON PARC D'ACTIVITES LEGE NORD 44650 LEGE France,NONE,NONE,NONE,ZONE INDUSTRIELLE ROUSSILLON,NONE,NONE,NONE,NONE,44650,LEGE,FRANCE,NONE,NONE,NONE,PARC ACTIVITERC D'ACTIVITES LEGE NORD,NONE,2,RUE DU ROUSSILLON,NONE,44650,LEGE,FRANCE,NoMatch
TRANSPORTS BOURIN,4 AVENUE DU CANAL DU BERRY 03100 MONTLUCON France,COMITE D ENTREPRISE TRANSPORTS BOURIN,21 RUE BENOIST D AZY 03100 MONTLUCON France,NONE,NONE,NONE,NONE,NONE,4,AVENUE DU CANAL DU BERRY,NONE,3100,MONTLUCON,FRANCE,NONE,NONE,NONE,NONE,NONE,21,RUE BENOIST D AZY,NONE,3100,MONTLUCON,FRANCE,NoMatch
STRALOG TRANSPORTS,"120, Rue Jules Siegfried 76600 LE HAVRE France",STRALOG TRANSPORTS,QUAI DE SOUTHAMPTON BAT FRET TERMINAL IRLANDE 76600 LE HAVRE France,NONE,NONE,NONE,NONE,NONE,120,RUE JULES SIEGFRIED,NONE,76600,LE HAVRE,FRANCE,NONE,BATIMENT FRET,TERMINAL IRLANDE,NONE,NONE,NONE,QUAI DE SOUTHAMPTON,NONE,76600,LE HAVRE,FRANCE,NoMatch
TREMBLAYE MULTITRANSPORTS,17 Rue Andr Citron 72000 LE MANS France,TREMBLAYE LOGISTIQUE,RUE HIPPOLYTE FOUCAULT ZI NORD 72000 LE MANS France,NONE,NONE,NONE,NONE,NONE,17,RUE ANDR CITRON,NONE,72000,LE MANS,FRANCE,NONE,NONE,NONE,ZONE INDUSTRIELLE NORD,NONE,NONE,RUE HIPPOLYTE FOUCAULT,NONE,72000,LE MANS,FRANCE,NoMatch
TLC - TRANSPORTS LOCATION COMMAGNAC,avenue Michel Grandou 24750 TRELISSAC France,JARDEL SERVICES,47 AV DE L AUTOMOBILE 24750 TRELISSAC France,NONE,NONE,NONE,NONE,NONE,NONE,AVENUE MICHEL GRANDOU,NONE,24750,TRELISSAC,FRANCE,NONE,NONE,NONE,NONE,NONE,47,AVENUE DE L AUTOMOBILE,NONE,24750,TRELISSAC,FRANCE,NoMatch
OVALIE TRANSPORTS,"ZI Croix Sud - 1, avenue du Forum 11100 NARBONNE France",M SOPHIEN DBILI L'EPICERIE DE L'OVALIE,14 AV DE TOULOUSE L'EPICERIE DE L'OVALIE 11100 NARBONNE France,NONE,NONE,NONE,ZONE INDUSTRIELLE CROIX SUD,NONE,1,AVENUE DU FORUM,NONE,11100,NARBONNE,FRANCE,NONE,NONE,NONE,L'EPICERIE DE L'OVALIE,NONE,14,AVENUE DE TOULOUSE,NONE,11100,NARBONNE,FRANCE,NoMatch
TRANSPORTS LE BERRE,ZAC de la liodiere 37300 JOUE LES TOURS France,TRANSPORTS LE BERRE,13 RUE DE LA LIODIERE ZAC DE LA LIODIERE NO 2 37300 JOUE LES TOURS France,NONE,NONE,NONE,ZONE ARTISANALEC DE LA LIODIERE,NONE,13,NONE,NONE,37300,JOUE LES TOURS,FRANCE,NONE,NONE,NONE,ZONE ARTISANALEC DE LA LIODIERE NO 2,NONE,13,RUE DE LA LIODIERE,NONE,37300,JOUE LES TOURS,FRANCE,PartialMatch
TRANSPORTS PEROCHEAU,1 alle de l Europe 85670 SAINT CHRISTOPHE DU LIGNERON France,TRANSPORTS PEROCHEAU TRANSPORTS PEROCHEAU SAS,PARC ACTIVITES JOSEPHINE 85670 SAINT CHRISTOPHE DU LIGNERON France,NONE,NONE,NONE,NONE,NONE,1,ALLE DE L EUROPE,NONE,85670,SAINT CHRISTOPHE,FRANCE,NONE,NONE,NONE,PARC ACTIVITE JOSEPHINE,NONE,NONE,NONE,NONE,85670,SAINT CHRISTOPHE,FRANCE,NoMatch
