companyI,AddI,CompanyK,AddK,INBUILDING,EXTBUILDING,POILOGISTIC,ZONE,DISTRICT,HOUSENUM,ROADNAME,POBOX,ZIPCODE,CITY,COUNTRY,INBUILDINGK,EXTBUILDINGK,POILOGISTICK,ZONEK,DISTRICTK,HOUSENUMK,ROADNAMEK,POBOXK,ZIPCODEK,CITYK,COUNTRYK,NewLabel
TRANSPORTS FRIGORIFIQUES DU ROANNAIS,120 rue de la pierre plante 42650 Saint Jean Bonnefonds France,TRANSPORTS FRIGORIFIQUES DU ROANNAIS,120 RUE DE LA PIERRE PLANTEE 42650 SAINT JEAN BONNEFONDS France,NONE,NONE,NONE,NONE,NONE,120,RUE DE LA PIERRE PLANTE,NONE,42650,SAINT JEAN BONNEFONDS,FRANCE,NONE,NONE,NONE,NONE,NONE,120,RUE DE LA PIERRE PLANTEE,NONE,42650,SAINT JEAN BONNEFONDS,FRANCE,Match
TRANSPORTS STIM,501 rue PAUL ROGER 60400 NOYON France,SOC TRANSP INTERNATIONAUX MAGASINAGE SOCIETE TRANSPORTS INTERNATIONAUX MAGASINAGE,501 RUE PAUL ROGER 60400 NOYON France,NONE,NONE,NONE,NONE,NONE,501,RUE PAUL ROGER,NONE,60400,NOYON,FRANCE,NONE,NONE,NONE,NONE,NONE,501,RUE PAUL ROGER,NONE,60400,NOYON,FRANCE,Match
TCF DEMENAGEMENTS,18 RUE PIERRE SEMARD ZI VOUILLANDS 38600 FONTAINE France,C.F.D. - DEMENAGEMENTS A.B.C. DEMENAGEMENTS T.C.F.,18 RUE PIERRE SEMARD 38600 FONTAINE France,NONE,NONE,NONE,ZONE INDUSTRIELLE VOUILLANDS,NONE,18,RUE PIERRE SEMARD,NONE,38600,FONTAINE,FRANCE,NONE,NONE,NONE,NONE,NONE,18,RUE PIERRE SEMARD,NONE,38600,FONTAINE,FRANCE,Match
TRANSPORTS SPECIOSO,"42, avenue de Rome 13127 Vitrolles France",SPECIOSO,42 AV DE ROME 13127 VITROLLES France,NONE,NONE,NONE,NONE,NONE,42,AVENUE DE ROME,NONE,13127,VITROLLES,FRANCE,NONE,NONE,NONE,NONE,NONE,42,AVENUE DE ROME,NONE,13127,VITROLLES,FRANCE,Match
LUX ROLAND DEMENAGEMENTS,3 Rue Joseph Marie Jacquard 67400 ILLKIRCH-GRAFFENSTADEN France,DEMENAGEMENTS LUX ROLAND,3 RUE JOSEPH MARIE JACQUARD 67400 ILLKIRCH GRAFFENSTADEN France,NONE,NONE,NONE,NONE,NONE,3,RUE JOSEPH MARIE JACQUARD,NONE,67400,ILLKIRCH GRAFFENSTADEN,FRANCE,NONE,NONE,NONE,NONE,NONE,3,RUE JOSEPH MARIE JACQUARD,NONE,67400,ILLKIRCH GRAFFENSTADEN,FRANCE,Match
LOGISTIQUE VINS DISTRIBUTION,265 rue du Beaujolais - Imp. du Moulin 69830 ST GEORGES DE RENEINS France,LOGISTIC VINS DISTRIBUTION LOGISTIC VINS DISTRIBUTION,265 RUE DU BEAUJOLAIS IMPASSE DU MOULIN 69830 SAINT GEORGES DE RENEINS France,NONE,NONE,NONE,NONE,NONE,265,RUE DU BEAUJOLAIS IMPASSE DU MOULIN,NONE,69830,SAINT GEORGES,FRANCE,NONE,NONE,NONE,NONE,NONE,265,RUE DU BEAUJOLAIS IMPASSE DU MOULIN,NONE,69830,SAINT GEORGES,FRANCE,Match
FEDEX EXPRESS FRANCE 10 TROYES,3 Rue William Catherine Booth 10000 TROYES France,FEDEX EXPRESS FRANCE F\XE9DEX EXPRESS FRANCE TROYES,7 RUE WILLIAM CATHERINE BOOTH 10000 TROYES France,NONE,NONE,NONE,NONE,NONE,3,RUE WILLIAM CATHERINE BOOTH,NONE,10000,TROYES,FRANCE,NONE,NONE,NONE,NONE,NONE,7,RUE WILLIAM CATHERINE BOOTH,NONE,10000,TROYES,FRANCE,PartialMatch
SOTRADEL FRET,45 CHEMIN DES PLAGNES 01600 SAINTE EUPHEMIE France,SOTRADEL FRET,45 CHE DES PLAGNES ZONE ARTISANALE 01600 SAINTE EUPHEMIE France,NONE,NONE,NONE,NONE,NONE,45,CHEMIN DES PLAGNES,NONE,1600,SAINTE EUPHEMIE,FRANCE,NONE,NONE,NONE,ZONE ARTISANALE,NONE,45,CHEMIN DES PLAGNES,NONE,1600,SAINTE EUPHEMIE,FRANCE,Match
MCANIQUE AUTO MOTO TRANSPORTS D'AQUITAINE,84 ROUTE DES ARTIQUES BP 28 33910 SAINT DENIS DE PILE FRANCE,MAMTA TRANSPORT M\XE9CANIQUE AUTO MOTO TRANSPORTS D'AQUITAINE,84 RTE DES ARTIGUES 33910 SAINT DENIS DE PILE France,NONE,NONE,NONE,NONE,NONE,84,ROUTE DES ARTIQUES,BP 28,33910,SAINT DENIS,FRANCE,NONE,NONE,NONE,NONE,NONE,84,ROUTE DES ARTIGUES,NONE,33910,SAINT DENIS,FRANCE,Match
SOCIT D'EXPLOITATION DES TRANSPORTS FOIX,6 RUE DE L'ARLAS 64303 ORTHEZ CDEX FRANCE,STE D'EXPLOITATION DES TRANSPORTS FOIX STE D'EXPLOITATION DES TRANSPORTS FOIX,6 RUE DE L ARLAS LOTBERRE BISTE 64300 ORTHEZ France,NONE,NONE,NONE,NONE,NONE,6,RUE DE L'ARLAS,NONE,64303,ORTHEZ,FRANCE,NONE,NONE,NONE,NONE,NONE,6,RUE DE L ARLAS LOTBERRE BISTE,NONE,64300,ORTHEZ,FRANCE,Match
CHAMFRAY CHRISTIAN,22 RUE LOUIS PRADEL 69960 CORBAS FRANCE,TRANSPORTS CHRISTIAN CHAMFRAY,22 RUE LOUIS PRADEL 69960 CORBAS France,NONE,NONE,NONE,NONE,NONE,22,RUE LOUIS PRADEL,NONE,69960,CORBAS,FRANCE,NONE,NONE,NONE,NONE,NONE,22,RUE LOUIS PRADEL,NONE,69960,CORBAS,FRANCE,Match
S.E AUTOCARS SUAU,47 avenue d'Albi 81250 ALBAN France,SOCIETE EXPLOITATION DES AUTOCARS SUAU SOCI\XE9T\XE9 D'EXPLOITATION DES AUTOCARS SUAU,47 AV D'ALBI 81250 ALBAN France,NONE,NONE,NONE,NONE,NONE,47,AVENUE D'ALBI,NONE,81250,ALBAN,FRANCE,NONE,NONE,NONE,NONE,NONE,47,AVENUE D'ALBI,NONE,81250,ALBAN,FRANCE,Match
EB TRANSPORTS,26 AVENUE RENE CASSIN 47200 MARMANDE FRANCE,EB TRANSPORTS,26 AV RENE CASSIN 47200 MARMANDE France,NONE,NONE,NONE,NONE,NONE,26,AVENUE RENE CASSIN,NONE,47200,MARMANDE,FRANCE,NONE,NONE,NONE,NONE,NONE,26,AVENUE RENE CASSIN,NONE,47200,MARMANDE,FRANCE,Match
TRANSPORTS FOULADOUX,7 RUE NEWTON 17440 AYTRE FRANCE,EURL TRANSPORTS FOULADOUX,7 RUE NEWTON 17440 AYTRE France,NONE,NONE,NONE,NONE,NONE,7,RUE NEWTON,NONE,17440,AYTRE,FRANCE,NONE,NONE,NONE,NONE,NONE,7,RUE NEWTON,NONE,17440,AYTRE,FRANCE,Match
WAYLOG,ZI LES FOURNELS - 370 CHEMIN DES FOURNELS 34400 LUNEL-VIEL France,WAYLOG,370 CHE DES FOURNELS 34400 LUNEL VIEL France,NONE,NONE,NONE,ZONE INDUSTRIELLE LES FOURNELS,NONE,370,CHEMIN DES FOURNELS,NONE,34400,LUNEL VIEL,FRANCE,NONE,NONE,NONE,NONE,NONE,370,CHEMIN DES FOURNELS,NONE,34400,LUNEL VIEL,FRANCE,Match
AQUITRANS,20 chem Barateau 33450 SAINT LOUBES France,AQUITRANS,20 CHE DE BARATEAU 33450 SAINT LOUBES France,NONE,NONE,NONE,NONE,NONE,20,CHEMIN BARATEAU,NONE,33450,SAINT LOUBES,FRANCE,NONE,NONE,NONE,NONE,NONE,20,CHEMIN DE BARATEAU,NONE,33450,SAINT LOUBES,FRANCE,Match
A.T.E.,12 bruyre des Valles 78113 Adainville France,M PASCAL SAULET A.T.E. DCS78,12 BRUYERE DES VALLEES 78113 ADAINVILLE France,NONE,NONE,NONE,NONE,NONE,12,BRUYRE DES VALLES,NONE,78113,ADAINVILLE,FRANCE,NONE,NONE,NONE,NONE,NONE,12,BRUYERE DES VALLEES,NONE,78113,ADAINVILLE,FRANCE,Match
ROAD FROID,4 rue des Arts 82000 MONTAUBAN France,SARL ROAD FROID,4 RUE DES ARTS 82000 MONTAUBAN France,NONE,NONE,NONE,NONE,NONE,4,RUE DES ARTS,NONE,82000,MONTAUBAN,FRANCE,NONE,NONE,NONE,NONE,NONE,4,RUE DES ARTS,NONE,82000,MONTAUBAN,FRANCE,Match
ROBERT QUEVEDO,208 route des tattes 74380 Cranves Sales France,M ROBERT QUEVEDO MONSIEUR ROBERT QUEVEDO,208 RTE DES TATTES DE BORLY 74380 CRANVES SALES France,NONE,NONE,NONE,NONE,NONE,208,ROUTE DES TATTES,NONE,74380,CRANVES SALES,FRANCE,NONE,NONE,NONE,NONE,NONE,208,ROUTE DES TATTES DE BORLY,NONE,74380,CRANVES SALES,FRANCE,Match
OMNIDEM,31 rue de la Viabert 69006 LYON France,OMNIDEM,31 RUE DE LA VIABERT 69006 LYON 6EME France,NONE,NONE,NONE,NONE,NONE,31,RUE DE LA VIABERT,NONE,69006,LYON,FRANCE,NONE,NONE,NONE,NONE,NONE,31,RUE DE LA VIABERT,NONE,69006,LYON,FRANCE,Match
FC TRADECO,81 RUE DU GNRAL GOURAUD 51400 MOURMELON LE GRAND FRANCE,F C TRANSPORTS DEMENAGEMENTS COMMERCES,81 RUE DU GENERAL GOURAUD 51400 MOURMELON LE GRAND France,NONE,NONE,NONE,NONE,NONE,81,RUE DU GNRAL GOURAUD,NONE,51400,MOURMELON LE GRAND,FRANCE,NONE,NONE,NONE,NONE,NONE,81,RUE DU GENERAL GOURAUD,NONE,51400,MOURMELON LE GRAND,FRANCE,Match
FERRYLOG,29 Rue Jules Ferry 10600 LA CHAPELLE ST LUC France,FERRYLOG,29 RUE JULES FERRY 10600 LA CHAPELLE SAINT LUC France,NONE,NONE,NONE,NONE,NONE,29,RUE JULES FERRY,NONE,10600,LA CHAPELLE,FRANCE,NONE,NONE,NONE,NONE,NONE,29,RUE JULES FERRY,NONE,10600,LA CHAPELLE,FRANCE,Match
MGJ TRANSPORTS,RUE JEAN-BAPTISTE COLBERT 10600 LA CHAPELLE ST LUC FRANCE,MGJ TRANSPORTS MGJ TRANSPORTS SARL,RUE JEAN BAPTISTE COLBERT 10600 LA CHAPELLE SAINT LUC France,NONE,NONE,NONE,NONE,NONE,NONE,RUE JEAN BAPTISTE COLBERT,NONE,10600,LA CHAPELLE,FRANCE,NONE,NONE,NONE,NONE,NONE,NONE,RUE JEAN BAPTISTE COLBERT,NONE,10600,LA CHAPELLE,FRANCE,Match
EVOLUTION COURSES SERVICES,7 Passage CARDINET 75017 PARIS France,SARL ECS EVOLUTION COURSES SERVICES,7 PAS CARDINET 75017 PARIS 17 France,NONE,NONE,NONE,NONE,NONE,7,PASSAGE CARDINET,NONE,75017,PARIS,FRANCE,NONE,NONE,NONE,NONE,NONE,7,PASSAGE CARDINET,NONE,75017,PARIS,FRANCE,Match
SEA ROAD LOGISTIC,10 RUE JEAN ROUXEL 44700 ORVAULT France,SEA ROAD LOGISTIC SEA ROAD LOGISTIC,ZA DE LA PENTECOTE CTREE D AFFAIRES 44700 ORVAULT France,NONE,NONE,NONE,NONE,NONE,10,RUE JEAN ROUXEL,NONE,44700,ORVAULT,FRANCE,NONE,NONE,NONE,ZONE ARTISANALE DE LA PENTECOTE CENTRE E D AFFAIRES,NONE,NONE,NONE,NONE,44700,ORVAULT,FRANCE,PartialMatch
BARY ET FILS,83 RUE DE THUREY 10180 SAINT BENOIT SUR SEINE FRANCE,SARL BARY ET FILS,83 RUE DE THUREY 10180 SAINT BENOIT SUR SEINE France,NONE,NONE,NONE,NONE,NONE,83,RUE DE THUREY,NONE,10180,SAINT BENOIT,FRANCE,NONE,NONE,NONE,NONE,NONE,83,RUE DE THUREY,NONE,10180,SAINT BENOIT,FRANCE,Match
FARGUES JEAN-PAUL,3 Ancien Chemin de Villeneuve 31120 PORTET SUR GARONNE France,M JEAN-PAUL FARGUES,3  CHEM DE VILLENEUVE 31120 PORTET SUR GARONNE France,NONE,NONE,NONE,NONE,NONE,3,ANCIEN CHEMIN DE VILLENEUVE,NONE,31120,PORTET SUR GARONNE,FRANCE,NONE,NONE,NONE,NONE,NONE,3,CHEMIN DE VILLENEUVE,NONE,31120,PORTET SUR GARONNE,FRANCE,Match
TRANSPORTS SOGNY SA,16 RUE DU CHANOINE HESS 51100 REIMS France,TRANSPORTS SOGNY,16 RUE DU CHANOINE HESS 51100 REIMS France,NONE,NONE,NONE,NONE,NONE,16,RUE DU CHANOINE HESS,NONE,51100,REIMS,FRANCE,NONE,NONE,NONE,NONE,NONE,16,RUE DU CHANOINE HESS,NONE,51100,REIMS,FRANCE,Match
DUMAIN ADRIEN ET FILS,ZI BALLASTIRE - 58 RUE DES DAGUEIS 33500 LIBOURNE FRANCE,DUMAIN ADRIEN ET FILS DUMAIN ET FILS,58 RUE DES DAGUEYS  33500 LIBOURNE France,NONE,NONE,NONE,NONE,NONE,58,RUE DES DAGUEIS,NONE,33500,LIBOURNE,FRANCE,NONE,NONE,NONE,ZONE INDUSTRIELLE LA BALLASTIERE,NONE,58,RUE DES DAGUEYS,NONE,33500,LIBOURNE,FRANCE,Match
TRANSPORTS BARTHES,17 RUE DE FENOUILLET 31140 SAINT ALBAN FRANCE,SARL TRANSPORTS BARTHES,17 RUE DE FENOUILLET 31140 SAINT ALBAN France,NONE,NONE,NONE,NONE,NONE,17,RUE DE FENOUILLET,NONE,31140,SAINT ALBAN,FRANCE,NONE,NONE,NONE,NONE,NONE,17,RUE DE FENOUILLET,NONE,31140,SAINT ALBAN,FRANCE,Match
COOS ENTREPRISE,300 CHEMIN DE MARQUE DEBAT 64530 GER FRANCE,EURL COOS ENTREPRISE,55 CHE DE MARQUE DEBAT 64530 GER France,NONE,NONE,NONE,NONE,NONE,300,CHEMIN DE MARQUE DEBAT,NONE,64530,GER,FRANCE,NONE,NONE,NONE,NONE,NONE,55,CHEMIN DE MARQUE DEBAT,NONE,64530,GER,FRANCE,PartialMatch
GROUPE HEPPNER,37 RUE DU LAVOIR 40230 ST VINCENT DE TYROSSE FRANCE,HEPPNER SOCIETE DE TRANSPORTS,RUE DU LAVOIR ZONE ARTISANAL CASABLANCA 40230 SAINT VINCENT DE TYROSSE France,NONE,NONE,NONE,NONE,NONE,37,RUE DU LAVOIR,NONE,40230,SAINT,FRANCE,NONE,LOTISSEMENT ARTISANAL CASABLANCA,NONE,ZONE ARTISANAL CASABLANCA,NONE,NONE,RUE DU LAVOIR,NONE,40230,SAINT,FRANCE,PartialMatch
HB EXPRESS,119 Avenue PIERRE SEMARD 84000 AVIGNON France,HB EXPRESS,150 AV PIERRE SEMARD 84000 AVIGNON France,NONE,NONE,NONE,NONE,NONE,119,AVENUE PIERRE SEMARD,NONE,84000,AVIGNON,FRANCE,NONE,NONE,NONE,NONE,NONE,150,AVENUE PIERRE SEMARD,NONE,84000,AVIGNON,FRANCE,PartialMatch
SOFRINO ( ENTREPOTS FRIGORIFIQUES 94 ),42 rue Charles Heller 94400 VITRY SUR SEINE France,SOFRINO,42 RUE CHARLES HELLER 42 54 94400 VITRY SUR SEINE France,NONE,NONE,NONE,NONE,NONE,42,RUE CHARLES HELLER,NONE,94400,VITRY SUR SEINE,FRANCE,NONE,NONE,NONE,NONE,NONE,42,RUE CHARLES HELLER,NONE,94400,VITRY SUR SEINE,FRANCE,Match
NORD OUEST EXPRESS,23 BIS RUE DE L'AVENIR 14650 CARPIQUET FRANCE,NORD OUEST EXPRESS NORMANDIE CAR SERVICE,23 B RUE DE L AVENIR 14650 CARPIQUET France,NONE,NONE,NONE,NONE,NONE,23,RUE DE L'AVENIR,NONE,14650,CARPIQUET,FRANCE,NONE,NONE,NONE,NONE,NONE,23,RUE DE L AVENIR,NONE,14650,CARPIQUET,FRANCE,Match
BREL TRANSPORTS,3056 AVENUE ETIENNE MEHUL 34070 MONTPELLIER FRANCE,TRANSPORTS BREL BREL TRANSPORTS,3056 AV ETIENNE MEHUL CS 15003 34070 MONTPELLIER France,NONE,NONE,NONE,NONE,NONE,3056,AVENUE ETIENNE MEHUL,NONE,34070,MONTPELLIER,FRANCE,NONE,NONE,NONE,NONE,NONE,3056,AVENUE ETIENNE MEHUL,NONE,34070,MONTPELLIER,FRANCE,Match
SLFT,"145, route de millery 69700 Montagny France",EURL SLFT SLFT,145 RTE DE MILLERY 69700 MONTAGNY France,NONE,NONE,NONE,NONE,NONE,145,ROUTE DE MILLERY,NONE,69700,MONTAGNY,FRANCE,NONE,NONE,NONE,NONE,NONE,145,ROUTE DE MILLERY,NONE,69700,MONTAGNY,FRANCE,Match
TRANSPORTS DELQU,"146 avenue des Etats-Unis, M.I.N. Cases 20,21,22 31200 TOULOUSE France",DELQUE PHILIPPE TRANSPORTS,146 AV DES ETATS UNIS 31200 TOULOUSE France,NONE,NONE,NONE,MIN,NONE,146,AVENUE DES ETATS UNIS,CASES 20 21 22,31200,TOULOUSE,FRANCE,NONE,NONE,NONE,NONE,NONE,146,AVENUE DES ETATS UNIS,NONE,31200,TOULOUSE,FRANCE,Match
TRANSPORTS JANVAL,"146, AVENUE DES ETATS-UNIS 31200 TOULOUSE FRANCE",TRANSPORT JANVAL,146 AV DES ETATS UNIS HALLES DU SUD OUEST 31200 TOULOUSE France,NONE,NONE,NONE,NONE,NONE,146,AVENUE DES ETATS UNIS,NONE,31200,TOULOUSE,FRANCE,NONE,NONE,NONE,NONE,NONE,146,AVENUE DES ETATS UNIS,NONE,31200,TOULOUSE,FRANCE,Match
ALACHI ET FILS,11 alle du catchre 31770 COLOMIERS France,TRANSPORTS ALACCHI ET FILS,11 ALL DE CATCHERE 31770 COLOMIERS France,NONE,NONE,NONE,NONE,NONE,11,ALLE DU CATCHRE,NONE,31770,COLOMIERS,FRANCE,NONE,NONE,NONE,NONE,NONE,11,ALLEE DE CATCHERE,NONE,31770,COLOMIERS,FRANCE,Match
TRANSPORTS BARTHES,17 RUE DE FENOUILLET 31140 SAINT ALBAN FRANCE,SARL TRANSPORTS BARTHES,17 RUE DE FENOUILLET 31140 SAINT ALBAN France,NONE,NONE,NONE,NONE,NONE,17,RUE DE FENOUILLET,NONE,31140,SAINT ALBAN,FRANCE,NONE,NONE,NONE,NONE,NONE,17,RUE DE FENOUILLET,NONE,31140,SAINT ALBAN,FRANCE,Match
TRANSIT TRANSPORTS BRUNO CATTIAU,4 rue Paul Eluard 59125 Trith Saint Lger France,TTBC,4 RUE PAUL ELUARD ZI N 2 59125 TRITH SAINT LEGER France,NONE,NONE,NONE,NONE,NONE,4,RUE PAUL ELUARD,NONE,59125,SAINT LEGER,FRANCE,NONE,NONE,NONE,ZONE INDUSTRIELLE NUMERO 2,NONE,4,RUE PAUL ELUARD,NONE,59125,SAINT LEGER,FRANCE,Match
CHALLENGE INTERNATIONAL GUADELOUPE,24 rue Nobel 97122 Baie - Mahault France,SEALOGIS FREIGHT FORWARDING,ZI DE JARRY 97122 BAIE MAHAULT France,NONE,NONE,NONE,NONE,NONE,24,RUE NOBEL,NONE,97122,BAIE MAHAULT,FRANCE,NONE,NONE,NONE,ZONE INDUSTRIELLE DE JARRY,NONE,NONE,NONE,NONE,97122,BAIE MAHAULT,FRANCE,PartialMatch
ARTOIS DEMENAGEMENTS,28 rue d En Haut 62130 ROELLECOURT France,ARTOIS DEMENAGEMENTS,28 RUE D'EN HAUT 62130 ROELLECOURT France,NONE,NONE,NONE,NONE,NONE,28,RUE D EN HAUT,NONE,62130,ROELLECOURT,FRANCE,NONE,NONE,NONE,NONE,NONE,28,RUE D'EN HAUT,NONE,62130,ROELLECOURT,FRANCE,Match
TRANSPORTS GROSSKOST,20 RUE PRINCIPALE 67112 BREUSCHWICKERSHEIM FRANCE,TRANSPORT GROSSKOST,20 RUE PRINCIPALE 67112 BREUSCHWICKERSHEIM France,NONE,NONE,NONE,NONE,NONE,20,RUE PRINCIPALE,NONE,67112,BREUSCHWICKERSHEIM,FRANCE,NONE,NONE,NONE,NONE,NONE,20,RUE PRINCIPALE,NONE,67112,BREUSCHWICKERSHEIM,FRANCE,Match
CHEVRIER DEMECO,90 BLD A BLANQUI 75013 PARIS FRANCE,AGENCE DIDIER CHEVRIER,90 BD AUGUSTE BLANQUI 75013 PARIS 13 France,NONE,NONE,NONE,NONE,NONE,90,BOULEVARD A BLANQUI,NONE,75013,PARIS,FRANCE,NONE,NONE,NONE,NONE,NONE,90,BOULEVARD AUGUSTE BLANQUI,NONE,75013,PARIS,FRANCE,Match
SAS PRUNET TRANSPORTS,516 CHEMIN DE VINDRAC BP 3 82300 MONTEILS FRANCE,SAS PRUNET TRANSPORTS PRUNET TRANSPORTS,500 CHE DE VINDRAC 82300 MONTEILS France,NONE,NONE,NONE,NONE,NONE,516,CHEMIN DE VINDRAC,BP 3,82300,MONTEILS,FRANCE,NONE,NONE,NONE,NONE,NONE,500,CHEMIN DE VINDRAC,NONE,82300,MONTEILS,FRANCE,PartialMatch
LAVAL FRERES TRANSPORTS,56 Route de Bergerac 33220 PINEUILH France,SOC EXPLOITATION LAVAL FRERES,56 RTE DE BERGERAC 33220 PINEUILH France,NONE,NONE,NONE,NONE,NONE,56,ROUTE DE BERGERAC,NONE,33220,PINEUILH,FRANCE,NONE,NONE,NONE,NONE,NONE,56,ROUTE DE BERGERAC,NONE,33220,PINEUILH,FRANCE,Match
TRANSPORTS GIRARD,100 Route de Clermont 95340 BERNES SUR OISE France,TRANSPORTS GIRARD,100 RTE DE CLERMONT 95340 BERNES SUR OISE France,NONE,NONE,NONE,NONE,NONE,100,ROUTE DE CLERMONT,NONE,95340,BERNES SUR OISE,FRANCE,NONE,NONE,NONE,NONE,NONE,100,ROUTE DE CLERMONT,NONE,95340,BERNES SUR OISE,FRANCE,Match
TRANSBEL,"29,Rue de Provence 38070 ST QUENTIN FALLAVIER France",TRANSBEL SARL TRANSBEL,29 RUE DE PROVENCE Z.I. DE CHESNES THARABIE 38070 SAINT QUENTIN FALLAVIER France,NONE,NONE,NONE,NONE,NONE,29,RUE DE PROVENCE,NONE,38070,SAINT QUENTIN,FRANCE,NONE,NONE,NONE,ZONE INDUSTRIELLE DE CHESNES THARABIE,NONE,29,RUE DE PROVENCE,NONE,38070,SAINT QUENTIN,FRANCE,Match
TRANSPORTS CLEMENTE ANDR,49 rue achaintre 71170 Chauffailles France,TRANSPORTS CLEMENTE ANDRE,49 RUE ANTONIN ACHAINTRE 71170 CHAUFFAILLES France,NONE,NONE,NONE,NONE,NONE,49,RUE ACHAINTRE,NONE,71170,CHAUFFAILLES,FRANCE,NONE,NONE,NONE,NONE,NONE,49,RUE ANTONIN ACHAINTRE,NONE,71170,CHAUFFAILLES,FRANCE,Match
ACCORDEM,67 Avenue de Verdun 77470 TRILPORT France,TRANSPORT PERU,67 AV DE VERDUN 77470 TRILPORT France,NONE,NONE,NONE,NONE,NONE,67,AVENUE DE VERDUN,NONE,77470,TRILPORT,FRANCE,NONE,NONE,NONE,NONE,NONE,67,AVENUE DE VERDUN,NONE,77470,TRILPORT,FRANCE,Match
SARL ZAFATI,Place Jeanne D Arc 31000 TOULOUSE France,SARL ZAFATI ZAFATI,PL JEANNE D ARC 31000 TOULOUSE France,NONE,NONE,NONE,NONE,NONE,NONE,PLACE JEANNE D ARCADE,NONE,31000,TOULOUSE,FRANCE,NONE,NONE,NONE,NONE,NONE,NONE,PLACE JEANNE D ARCADE,NONE,31000,TOULOUSE,FRANCE,Match
MESSAGERIES DES CHAMPS ELYSEES,9 Rue Frdric Bastiat 75008 PARIS France,MESSAGERIES DES CHAMPS ELYSEES MCE EXPRESS,9 RUE FREDERIC BASTIAT 75008 PARIS 8 France,NONE,NONE,NONE,NONE,NONE,9,RUE FRDRIC BASTIAT,NONE,75008,PARIS,FRANCE,NONE,NONE,NONE,NONE,NONE,9,RUE FREDERIC BASTIAT,NONE,75008,PARIS,FRANCE,Match
CHOLLOT SA,19 RUE DES MINES 54800 JARNY FRANCE,ETABLISSEMENTS CHOLLOT CHOLLOT S.A.,19 RUE DES MINES 54800 JARNY France,NONE,NONE,NONE,NONE,NONE,19,RUE DES MINES,NONE,54800,JARNY,FRANCE,NONE,NONE,NONE,NONE,NONE,19,RUE DES MINES,NONE,54800,JARNY,FRANCE,Match
LA CATALANE DE TRANSIT,4 avenue de Toulouse 31650 SAINT ORENS DE GAMEVILLE France,LA CATALANE DE TRANSIT CATRANS - YSAL,4 AV DE TOULOUSE 31650 SAINT ORENS DE GAMEVILLE France,NONE,NONE,NONE,NONE,NONE,4,AVENUE DE TOULOUSE,NONE,31650,SAINT ORENS DE GAMEVILLE,FRANCE,NONE,NONE,NONE,NONE,NONE,4,AVENUE DE TOULOUSE,NONE,31650,SAINT ORENS DE GAMEVILLE,FRANCE,Match
S.T.D.G.,PA Les Taches 9 Avenue des Pays Bas 69330 MEYZIEU France,DUCOURNAU TRANSPORTS,9 AV DES PAYS BAS 69330 MEYZIEU France,NONE,NONE,NONE,PARC ACTIVITERC D'ACTIVITE LES TACHES,NONE,9,AVENUE DES PAYS BAS,NONE,69330,MEYZIEU,FRANCE,NONE,NONE,NONE,NONE,NONE,9,AVENUE DES PAYS BAS,NONE,69330,MEYZIEU,FRANCE,Match
CRPEAU MAURICE,46 boulevard Arago 36000 CHATEAUROUX France,DEMENAGEMENTS MAURICE CREPEAU,46 BD ARAGO 36000 CHATEAUROUX France,NONE,NONE,NONE,NONE,NONE,46,BOULEVARD ARAGO,NONE,36000,CHATEAUROUX,FRANCE,NONE,NONE,NONE,NONE,NONE,46,BOULEVARD ARAGO,NONE,36000,CHATEAUROUX,FRANCE,Match
TRANSPORTS ROISSY GLOBAL EXPRESS,10 RUE CHABRIER 93290 TREMBLAY EN FRANCE France,ROISSY GLOBAL EXPRESS,10 RUE CHABRIER 93290 TREMBLAY EN FRANCE France,NONE,NONE,NONE,NONE,NONE,10,RUE CHABRIER FRANCE,NONE,93290,TREMBLAY EN,FRANCE,NONE,NONE,NONE,NONE,NONE,10,RUE CHABRIER FRANCE,NONE,93290,TREMBLAY EN,FRANCE,Match
TSG,8 rue des Acacias 77230 Villeneuve Sous Dammartin France,T.S.G. TSG,8 RUE DES ACACIAS 77230 VILLENEUVE SOUS DAMMARTIN France,NONE,NONE,NONE,NONE,NONE,8,RUE DES ACACIAS,NONE,77230,VILLENEUVE SOUS DAMMARTIN,FRANCE,NONE,NONE,NONE,NONE,NONE,8,RUE DES ACACIAS,NONE,77230,VILLENEUVE SOUS DAMMARTIN,FRANCE,Match
TRANSPORTS LEFORT,ZI 121 AVENUE DE L'ARODROME 33260 LA TESTE FRANCE,LEFORT FRERES,121 AV DE L AERODROME ZI 33260 LA TESTE DE BUCH France,NONE,NONE,NONE,ZONE INDUSTRIELLE,NONE,121,AVENUE DE L'ARODROME,NONE,33260,LA TESTE DE BUCH,FRANCE,NONE,NONE,AERODROME,ZONE INDUSTRIELLE,NONE,121,AVENUE DE L'ARODROME,NONE,33260,LA TESTE DE BUCH,FRANCE,Match
BLANCHET DEMENAGEMENTS,284 Rue Nationale 36400 LA CHATRE France,DEMENAGEMENTS R BLANCHET,210 RUE NATIONALE 36400 LA CHATRE France,NONE,NONE,NONE,NONE,NONE,284,RUE NATIONALE,NONE,36400,LA CHATRE,FRANCE,NONE,NONE,NONE,NONE,NONE,210,RUE NATIONALE,NONE,36400,LA CHATRE,FRANCE,PartialMatch
TRANSPORTS TRESSENS ET FILS,route de Castres 81570 VIELMUR SUR AGOUT France,ENTREPRISE PIERRE TRESSENS ET FILS TRANSPORT TRAMONTANE,RTE DE CASTRES 81570 VIELMUR SUR AGOUT France,NONE,NONE,NONE,NONE,NONE,NONE,ROUTE DE CASTRES,NONE,81570,VIELMUR SUR AGOUT,FRANCE,NONE,NONE,NONE,NONE,NONE,NONE,ROUTE DE CASTRES,NONE,81570,VIELMUR SUR AGOUT,FRANCE,Match
JAUFFRET DEMENAGEMENTS,159 rue du petit mas ZI courtine 84000 AVIGNON France,AVIGNON EUROPE DEMENAGEM TRPTS AVIGNON EUROPE D\XE9M\XE9NAGEMENTS TRANSPORTS SOCI\XE9T\XE9 NOUVELLE DES ETABLISSEMENTS JAUFFRET,159 RUE DU PETIT MAS ZONE INDUSTRIELLE DE COURTINE 84000 AVIGNON France,NONE,NONE,NONE,ZONE INDUSTRIELLE COURTINE,NONE,159,RUE DU PETIT MAS,NONE,84000,AVIGNON,FRANCE,NONE,NONE,NONE,ZONE INDUSTRIELLE DE COURTINE,NONE,159,RUE DU PETIT MAS,NONE,84000,AVIGNON,FRANCE,Match
CALBERSON 82 MONTAUBAN,497 IMPASSE JACQUES DAGUERRE - ZONE ARTISANALE ALBASUD 82000 MONTAUBAN France,CALBERSON SUD OUEST,497 IMP JACQUES DAGUERRE ZA ALBASUD 82000 MONTAUBAN France,NONE,NONE,NONE,ZONE ARTISANALE ALBASUD,NONE,497,IMPASSE JACQUES DAGUERRE,NONE,82000,MONTAUBAN,FRANCE,NONE,NONE,NONE,ZONE ARTISANALE ALBASUD,NONE,497,IMPASSE JACQUES DAGUERRE,NONE,82000,MONTAUBAN,FRANCE,Match
BREFORT,195 RUE LUCIEN SUEUR 60130 WAVIGNIES FRANCE,EARL BREFORT PATRICE,195 RUE LUCIEN SUEUR 60130 WAVIGNIES France,NONE,NONE,NONE,NONE,NONE,195,RUE LUCIEN SUEUR,NONE,60130,WAVIGNIES,FRANCE,NONE,NONE,NONE,NONE,NONE,195,RUE LUCIEN SUEUR,NONE,60130,WAVIGNIES,FRANCE,Match
MORILLE DEMENAGEMENTS,23 RUE CROIX RENAUDEAU 49120 CHEMILLE FRANCE,UNIP TRANSPORT DEMENAGEMENT MORILLE TRANSPORTS D\XE9M\XE9NAGEMENTS MORILLE,23 RUE DE LA CROIX RENAUDEAU 49120 CHEMILLE EN ANJOU France,NONE,NONE,NONE,NONE,NONE,23,RUE CROIX RENAUDEAU,NONE,49120,CHEMILLE,FRANCE,NONE,NONE,NONE,NONE,NONE,23,RUE DE LA CROIX RENAUDEAU,NONE,49120,CHEMILLE,FRANCE,Match
TRANSPORTS JEAN-CLAUDE ABADIE,5 Rue de l'Artisanat 64680 OGEU LES BAINS France,TRANSPORTS ABADIE J C ETABLISSEMENT ABADIE JEAN CLAUDE,5 RUE DE L ARTISANAT 64680 OGEU LES BAINS France,NONE,NONE,NONE,NONE,NONE,5,RUE DE L'ARTISANAT,NONE,64680,OGEU LES BAINS,FRANCE,NONE,NONE,NONE,NONE,NONE,5,RUE DE L ARTISANAT,NONE,64680,OGEU LES BAINS,FRANCE,Match
AFRADEM,168 BOULEVARD VINCENT AURIOL 75013 PARIS FRANCE,AFRADEM,168 BD VINCENT AURIOL 75013 PARIS 13 France,NONE,NONE,NONE,NONE,NONE,168,BOULEVARD VINCENT AURIOL,NONE,75013,PARIS,FRANCE,NONE,NONE,NONE,NONE,NONE,168,BOULEVARD VINCENT AURIOL,NONE,75013,PARIS,FRANCE,Match
LOVEST,2 Rue du Livre 67120 MOLSHEIM France,SOCIETE LOVEST LOVEST,2 RUE DU LIEVRE 67120 MOLSHEIM France,NONE,NONE,NONE,NONE,NONE,2,RUE DU LIVRE,NONE,67120,MOLSHEIM,FRANCE,NONE,NONE,NONE,NONE,NONE,2,RUE DU LIEVRE,NONE,67120,MOLSHEIM,FRANCE,Match
COFFINET TRANSPORTS,1 ROUTE DES TEMPLIERS 10260 MONTCEAUX LES VAUDES FRANCE,SARL COFFINET,1 RTE DES TEMPLIERS 10260 MONTCEAUX LES VAUDES France,NONE,NONE,NONE,NONE,NONE,1,ROUTE DES TEMPLIERS,NONE,10260,VAUDES,FRANCE,NONE,NONE,NONE,NONE,NONE,1,ROUTE DES TEMPLIERS,NONE,10260,VAUDES,FRANCE,Match
LOC'ACTIVE,ZA ERDRE ACTIVE 10 R TOSCANE 44240 LA CHAPELLE SUR ERDRE FRANCE,TRANSPORTS COUVERT,10 RUE DE LA TOSCANE 44240 LA CHAPELLE SUR ERDRE France,NONE,NONE,NONE,ZONE ARTISANALE ERDRE ACTIVE,NONE,10,RUE DE LA TOSCANE,NONE,44240,LA CHAPELLE SUR ERDRE,FRANCE,NONE,NONE,NONE,NONE,NONE,10,RUE DE LA TOSCANE,NONE,44240,LA CHAPELLE SUR ERDRE,FRANCE,Match
AGENCE PARIS DEM,av Pierre Smard 94200 Ivry Sur Seine France,AGENCE PARIS DEM,19 AV PIERRE SEMARD 94200 IVRY SUR SEINE France,NONE,NONE,NONE,NONE,NONE,19,AVENUE PIERRE SMARD,NONE,94200,IVRY SUR SEINE,FRANCE,NONE,NONE,NONE,NONE,NONE,19,AVENUE PIERRE SEMARD,NONE,94200,IVRY SUR SEINE,FRANCE,Match
SE TRANSPORT ENGEL SARL,RUE HENRI MARTINET 51290 MARGERIE HANCOURT FRANCE,SARL D EXPLOITATION TRANSPORTS ENGEL SARL ENGEL,RUE HENRI MARTINET 51290 MARGERIE HANCOURT France,NONE,NONE,NONE,NONE,NONE,NONE,RUE HENRI MARTINET,NONE,51290,MARGERIE HANCOURT,FRANCE,NONE,NONE,NONE,NONE,NONE,NONE,RUE HENRI MARTINET,NONE,51290,MARGERIE HANCOURT,FRANCE,Match
CHRONO COLIS SERVICES,avenue saint Guillan 31620 CASTELNAU D'ESTRETEFONDS France,CHRONO COLIS SERVICES,AV DE SAINT GUILLAN EUROCENTRE 31620 CASTELNAU D'ESTRETEFONDS France,NONE,NONE,NONE,NONE,NONE,NONE,AVENUE SAINT GUILLAN,NONE,31620,CASTELNAU D'ESTRETEFONDS,FRANCE,NONE,NONE,NONE,EUROCENTRE,NONE,NONE,AVENUE DE SAINT GUILLAN,NONE,31620,CASTELNAU D'ESTRETEFONDS,FRANCE,Match
DFENSE 2000 COURSES,Square Lon Blum 92800 PUTEAUX France,DEFENSE 2000 COURSES,SQ LEON BLUM 92800 PUTEAUX France,NONE,NONE,NONE,NONE,NONE,NONE,SQUARE LON BLUM,NONE,92800,PUTEAUX,FRANCE,NONE,NONE,NONE,NONE,NONE,NONE,SQUARE LEON BLUM,NONE,92800,PUTEAUX,FRANCE,Match
AB PLUS,rue Patay 75013 PARIS France,AB PLUS,RUE DE PATAY 75013 PARIS 13 France,NONE,NONE,NONE,NONE,NONE,NONE,RUE PATAY,NONE,75013,PARIS,FRANCE,NONE,NONE,NONE,NONE,NONE,NONE,RUE DE PATAY,NONE,75013,PARIS,FRANCE,Match
SAUNIER EXPRESS,route de Neuville 45760 VENNECY France,SAUNIER EXPRESS,RTE DE NEUVILLE 45760 VENNECY France,NONE,NONE,NONE,NONE,NONE,NONE,ROUTE DE NEUVILLE,NONE,45760,VENNECY,FRANCE,NONE,NONE,NONE,NONE,NONE,NONE,ROUTE DE NEUVILLE,NONE,45760,VENNECY,FRANCE,Match
MORLET,Route de Neuflige 08300 LE CHATELET SUR RETOURNE France,SARL MORLET,RTE DE NEUFLIZE 08300 LE CHATELET SUR RETOURNE France,NONE,NONE,NONE,NONE,NONE,NONE,ROUTE DE NEUFLIGE,NONE,8300,LE CHATELET SUR RETOURNE,FRANCE,NONE,NONE,NONE,NONE,NONE,NONE,ROUTE DE NEUFLIZE,NONE,8300,LE CHATELET SUR RETOURNE,FRANCE,Match
DELAS ALAIN,ROUTE ROCHELLE 79000 BESSINES FRANCE,M ALAIN DELAS,RTE DE LA ROCHELLE 79000 BESSINES France,NONE,NONE,NONE,NONE,NONE,NONE,ROUTE ROCHELLE,NONE,79000,BESSINES,FRANCE,NONE,NONE,NONE,NONE,NONE,NONE,ROUTE DE LA ROCHELLE,NONE,79000,BESSINES,FRANCE,Match
FRANCE CARGO INTERNATIONAL CIE,Avenue Marc Sangnier 92390 VILLENEUVE LA GARENNE France,FRANCE CARGO INTERNATIONAL COMPANY FRANCE CARGO INTERNATIONAL,AV MARC SANGNIER 92390 VILLENEUVE LA GARENNE France,NONE,NONE,NONE,NONE,NONE,NONE,AVENUE MARC SANGNIER,NONE,92390,VILLENEUVE LA GARENNE,FRANCE,NONE,NONE,NONE,NONE,NONE,NONE,AVENUE MARC SANGNIER,NONE,92390,VILLENEUVE LA GARENNE,FRANCE,Match
TRANSPORTS NMP,28 RUE JEAN POULMARCH 95100 ARGENTEUIL FRANCE,TRANSPORT NMP,28 RUE JEAN POULMARCH 95100 ARGENTEUIL France,NONE,NONE,NONE,NONE,NONE,28,RUE JEAN POULMARCH,NONE,95100,ARGENTEUIL,FRANCE,NONE,NONE,NONE,NONE,NONE,28,RUE JEAN POULMARCH,NONE,95100,ARGENTEUIL,FRANCE,Match
