companyI,AddI,CompanyK,AddK,INBUILDING,EXTBUILDING,POILOGISTIC,ZONE,DISTRICT,HOUSENUM,ROADNAME,POBOX,ZIPCODE,CITY,COUNTRY,INBUILDINGK,EXTBUILDINGK,POILOGISTICK,ZONEK,DISTRICTK,HOUSENUMK,ROADNAMEK,POBOXK,ZIPCODEK,CITYK,COUNTRYK,NewLabel
KUEHNE ET NAGEL,10 Rue Andr Marie Ampre 33560 CARBON BLANC France,KUEHNE+NAGEL,19 PARC PEP DU BOS PLAN 33750 BEYCHAC ET CAILLAU France,NONE,NONE,NONE,NONE,NONE,10,RUE ANDR MARIE AMPRE,NONE,33560,CARBON BLANC,FRANCE,NONE,NONE,NONE,PARC ACTIVITERC PEP DU BOS PLAN,NONE,NONE,NONE,NONE,33750,BEYCHAC ET CAILLAU,FRANCE,NoMatch
LE RAY TRANSPORT ET LOGISTIQUE,35 Bld Haie des Cognets 35136 ST JACQUES DE LA LANDE France,TRANSPORTS LERAY NEWCOLD,CROIX ST JACQUES ZONZ ACTIVITES 54840 GONDREVILLE France,NONE,NONE,NONE,NONE,NONE,35,BOULEVARD HAIE DES COGNETS,NONE,35136,SAINT JACQUES,FRANCE,NONE,NONE,NONE,CROIX SAINT JACQUES ZONZ ACTIVITES,NONE,NONE,NONE,NONE,54840,GONDREVILLE,FRANCE,NoMatch
BENITO,Alles Ren Cassagne Zac 33310 LORMONT France,M STAN BERNARDI,56 RUE DU DOCTEUR DUFOURG APT 31 RES BIRBOIS 33470 GUJAN MESTRAS France,NONE,NONE,NONE,ZONE ARTISANALEC,NONE,NONE,ALLES REN CASSAGNE,NONE,33310,LORMONT,FRANCE,APPARTEMENT 31,RESIDENCE BIRBOIS,NONE,NONE,NONE,56,RUE DU DOCTEUR DUFOURG,NONE,33470,GUJAN MESTRAS,FRANCE,NoMatch
ABEILLE RUSH,8 bis Rue Augustin Drapiez 59000 LILLE France,ABEILLE RUSH,19 RUE DE LA POINTE 59113 SECLIN France,NONE,NONE,NONE,NONE,NONE,8,RUE AUGUSTIN DRAPIEZ,NONE,59000,LILLE,FRANCE,NONE,NONE,NONE,NONE,NONE,19,RUE DE LA POINTE,NONE,59113,SECLIN,FRANCE,NoMatch
TEMP,14 place Jean Jaures 07300 Tournon Sur Rhne France,SAVIEL FRANCE,AV DES GRANDS CRUS 26600 TAIN L'HERMITAGE France,NONE,NONE,NONE,NONE,NONE,14,PLACE JEAN JAURES,NONE,7300,TOURNON,FRANCE,NONE,NONE,NONE,NONE,NONE,NONE,AVENUE DES GRANDS CRUS,NONE,26600,TAIN L'HERMITAGE,FRANCE,NoMatch
DHL 95 - DANZAS 95 ROISSY EXPRESS,"241, RUE BELLE ETOILE - ZI PARIS NORD II 56252 95700 ROISSY FRANCE",DHL STOCK EXPRESS SAS DHL SUPPLY CHAIN,18 AV DU FOND DE VAUX 95310 SAINT OUEN L'AUMONE France,NONE,NONE,NONE,ZONE INDUSTRIELLE PARC ACTIVITERIS NORD II,NONE,241,RUE BELLE ETOILE,NONE,95700,ROISSY,FRANCE,NONE,NONE,NONE,NONE,NONE,18,AVENUE DU FOND DE VAUX,NONE,95310,SAINT OUEN L'AUMONE,FRANCE,NoMatch
GALAX ROISSY,4 rue Chapelier - Zone Frt 4 95704 ROISSY EN FRANCE France,GALAX TRANSPORTS GALAX',4 RUE DU CHAPELIER ZONE DE FRET N\xb04 93290 TREMBLAY EN FRANCE France,NONE,NONE,NONE,ZONE FRT 4,NONE,4,RUE CHAPELIER,NONE,95704,ROISSY EN FRANCE,FRANCE,NONE,NONE,NONE,ZONE DE FRET,NONE,4,RUE DU CHAPELIER,NONE,93290,ROISSY EN FRANCE,FRANCE,Match
TRANS DJR BROUSSE,111 route de Taninges 74106 ANNEMASSE France,TRANS DJR-BROUSSE,111 RTE DE TANINGES 74100 VETRAZ MONTHOUX France,NONE,NONE,NONE,NONE,NONE,111,ROUTE DE TANINGES,NONE,74106,ANNEMASSE,FRANCE,NONE,NONE,NONE,NONE,NONE,111,ROUTE DE TANINGES,NONE,74100,VETRAZ MONTHOUX,FRANCE,NoMatch
TRANSPORTS LORIOL,Quartier des Marlhes BP 82 26300 ALIXAN France,SOCIETE DES TRANSPORTS GEORGES BERNARD ST\XE9 TRANSPORTS BERNARD G. SA,ZI DE CHAMPGRAND PARC D'ACTIVITES 26270 LORIOL SUR DROME France,NONE,NONE,NONE,NONE,NONE,NONE,NONE,BP 82,26300,ALIXAN,FRANCE,NONE,NONE,NONE,ZONE INDUSTRIELLE DE CHAMPGRAND PARC ACTIVITERC D'ACTIVITES,NONE,NONE,NONE,NONE,26270,LORIOL SUR DROME,FRANCE,NoMatch
PLANET'TRANSPORT,1 chemin La Sablonnire 45230 CHATILLON COLIGNY France,PLANETE VERTE,42 B RUE DE LA PAIX 10000 TROYES France,NONE,NONE,NONE,NONE,NONE,1,CHEMIN LA SABLONNIRE,NONE,45230,CHATILLON COLIGNY,FRANCE,NONE,NONE,NONE,NONE,NONE,42 B,RUE DE LA PAIX,NONE,10000,TROYES,FRANCE,NoMatch
PLANET'TRANSPORT,1 chemin La Sablonnire 45230 CHATILLON COLIGNY France,PLANETE ENER-J,67 RUE ARISTIDE BRIAND 77124 VILLENOY France,NONE,NONE,NONE,NONE,NONE,1,CHEMIN LA SABLONNIRE,NONE,45230,CHATILLON COLIGNY,FRANCE,NONE,NONE,NONE,NONE,NONE,67,RUE ARISTIDE BRIAND,NONE,77124,VILLENOY,FRANCE,NoMatch
QUIL TRANSPORTS,12 Alle Frnes Parc Haye 54840 VELAINE EN HAYE France,TRANSPORTS QUIL VRAC,23 RUE DES CHENES ZAE VELAINE EN HAYE 54840 BOIS DE HAYE France,NONE,NONE,NONE,PARC ACTIVITERC HAYE,NONE,12,ALLE FRNES,NONE,54840,VELAINE EN HAYE,FRANCE,NONE,NONE,NONE,ZONE ARTISANALEE VELAINE EN HAYE,NONE,23,RUE DES CHENES,NONE,54840,BOIS DE HAYE,FRANCE,NoMatch
TRANSPORTS ARNAUDIN,Lieu-dit 33230 GUITRES France,SOC NOUV DES TRANSPORTS ARNAUDIN SOCIETE NOUVELLE DES TRANSPORTS ARNAUDIN,ZONE D ACTIVITE D ANGLUMEAU 33450 IZON France,NONE,NONE,NONE,NONE,NONE,NONE,LIEU DIT,NONE,33230,GUITRES,FRANCE,NONE,NONE,NONE,ZONE ARTISANALEE D ANGLUMEAU,NONE,NONE,NONE,NONE,33450,IZON,FRANCE,NoMatch
MATHIEU TRANSPORTS,ZI DE RIBEROLLES 09300 DREUILHE France,MATHIEU TOULOUSE MATHIEU TRANSPORTS,9 AV DE FONTREAL EUROCENTRE CEDEX 31621 31620 VILLENEUVE LES BOULOC France,NONE,NONE,NONE,ZONE INDUSTRIELLE DE RIBEROLLES,NONE,NONE,NONE,NONE,9300,DREUILHE,FRANCE,NONE,NONE,NONE,CENTRE FRANCE,NONE,9,AVENUE DE FONTREAL EURO,NONE,NONE,EURO,FRANCE,NoMatch
TTOM,18 rue Sadi CARNOT 97420 LE PORT France,TTOM TRAMAR TRANSIT OUTRE-MER,21 AV MARX DORMOY 13230 PORT SAINT LOUIS DU RHONE France,NONE,NONE,NONE,NONE,NONE,18,RUE SADI CARNOT,NONE,97420,LE PORT,FRANCE,NONE,NONE,NONE,NONE,NONE,21,AVENUE MARX DORMOY,NONE,13230,PORT SAINT LOUIS DU RHONE,FRANCE,NoMatch
TRANSPORTS BARBE,Zi 7 rue du Port BP 75 21604 LONGVIC Cdex France,TRANSPORTS BARBE,28 B AV DE STALINGRAD 21000 DIJON France,NONE,NONE,NONE,ZONE INDUSTRIELLE,NONE,7,RUE DU PORT,BP 75,21604,LONGVIC,FRANCE,NONE,NONE,NONE,NONE,NONE,28 B,AVENUE DE STALINGRAD,NONE,21000,DIJON,FRANCE,NoMatch
BERNIS PERIGUEUX,ZI - Avenue Ambroise Croizat 12 24025 PERIGUEUX Cedex France,TRANSPORTS BERNIS,AV AMBROISE CROIZAT ZI 24750 BOULAZAC ISLE MANOIRE France,NONE,NONE,NONE,ZONE INDUSTRIELLE,NONE,12,AVENUE AMBROISE CROIZAT,NONE,24025,PERIGUEUX,FRANCE,NONE,NONE,NONE,ZONE INDUSTRIELLE,NONE,NONE,AVENUE AMBROISE CROIZAT,NONE,24750,BOULAZAC,FRANCE,NoMatch
AA COLIS TRANSPORT RAPIDE ( TRANSPORT EXPRESS 78 ),33 rue des merisier 78711 Mantes La Ville France,CROSSLOG INTERNATIONAL,104 RUE DENIS PAPIN 77550 MOISSY CRAMAYEL France,NONE,NONE,NONE,NONE,NONE,33,RUE DES MERISIER,NONE,78711,MANTES LA VILLE,FRANCE,NONE,NONE,NONE,NONE,NONE,104,RUE DENIS PAPIN,NONE,77550,MOISSY CRAMAYEL,FRANCE,NoMatch
AA COLIS TRANSPORT RAPIDE ( TRANSPORT EXPRESS 78 ),33 rue des merisier 78711 Mantes La Ville France,7 URG,106 AV DES ROISSY HAUTS 91540 ORMOY France,NONE,NONE,NONE,NONE,NONE,33,RUE DES MERISIER,NONE,78711,MANTES LA VILLE,FRANCE,NONE,NONE,NONE,NONE,NONE,106,AVENUE DES ROISSY HAUTS,NONE,91540,ORMOY,FRANCE,NoMatch
TRANSPORTS DELAUNAY SAS,20 ROUTE DE PARIS 27320 NONANCOURT FRANCE,DELAUNAY LOGISTIQUE,1 RUE DES OSMEAUX 28100 DREUX France,NONE,NONE,NONE,NONE,NONE,20,ROUTE DE PARIS,NONE,27320,NONANCOURT,FRANCE,NONE,NONE,NONE,NONE,NONE,1,RUE DES OSMEAUX,NONE,28100,DREUX,FRANCE,NoMatch
WILLIAME TRANSPORTS,44 rue des Chasseurs a Pied 59570 LA LONGUEVILLE France,GHESTEM MAUBEUGE TRANSPORTS WILLIAME SAS,20 RUE DE LA VAQUERESSE 59131 ROUSIES France,NONE,NONE,NONE,NONE,NONE,44,RUE DES CHASSEURS A PIED,NONE,59570,LA LONGUEVILLE,FRANCE,NONE,NONE,NONE,NONE,NONE,20,RUE DE LA VAQUERESSE,NONE,59131,ROUSIES,FRANCE,NoMatch
WILLIAME TRANSPORTS,44 rue des Chasseurs a Pied 59570 LA LONGUEVILLE France,M WILLIAM DANTON,1 CHE DE LONGUEVILLE 10170 DROUPT SAINTE MARIE France,NONE,NONE,NONE,NONE,NONE,44,RUE DES CHASSEURS A PIED,NONE,59570,LA LONGUEVILLE,FRANCE,NONE,NONE,NONE,NONE,NONE,1,CHEMIN DE LONGUEVILLE,NONE,10170,SAINTE MARIE,FRANCE,NoMatch
RIVIERE TRANSPORTS,MAISONCELLES 14350 SAINT CHARLES DE PERCY FRANCE,RIVIERE TRANSPORTS,1465 BD CHARLES CROS 14123 IFS France,NONE,NONE,NONE,MAISONCELLES,NONE,NONE,NONE,NONE,14350,SAINT CHARLES DE PERCY,FRANCE,NONE,NONE,NONE,NONE,NONE,1465,BOULEVARD CHARLES CROS,NONE,14123,IFS,FRANCE,NoMatch
DHL 75 - DANZAS 75 PARIS 2,23 rue Feydeau 75002 PARIS France,DHL GLOBAL FORWARDING (FRANCE) SAS,27 RUE DE LA BELLE BORNE 93290 TREMBLAY EN FRANCE France,NONE,NONE,NONE,NONE,NONE,23,RUE FEYDEAU,NONE,75002,PARIS,FRANCE,NONE,NONE,NONE,NONE,NONE,27,RUE DE LA BELLE BORNE,NONE,93290,TREMBLAY EN,FRANCE,NoMatch
FRIGO VAL DE MEUSE,3B Route Avrecourt 52140 MONTIGNY LE ROI France,FRIGO VAL DE MEUSE,3 B RTE D AVRECOURT 52140 VAL DE MEUSE France,NONE,NONE,NONE,NONE,NONE,3,ROUTE AVRECOURT,NONE,52140,MONTIGNY,FRANCE,NONE,NONE,NONE,NONE,NONE,3,ROUTE D AVRECOURT,NONE,52140,MEUSE,FRANCE,NoMatch
GONDRAND,10 allee de la Falgalarie 512 81204 AUSSILLON MAZAMET France,SFTGF SOC FRANCAISE TRANSPORTS GONDRAND FRERES,43 CARREFOUR DE L EUROPE 81300 GRAULHET France,NONE,NONE,NONE,NONE,NONE,10,ALLEE DE LA FALGALARIE,NONE,81204,AUSSILLON,FRANCE,NONE,NONE,NONE,NONE,NONE,43,CARREFOUR DE L EUROPE,NONE,81300,GRAULHET,FRANCE,NoMatch
FRIGO VAL DE MEUSE,3B Route Avrecourt 52140 MONTIGNY LE ROI France,ENTREMONT ALLIANCE,1 RUE ANNE MARIE LEGROS 52140 VAL DE MEUSE France,NONE,NONE,NONE,NONE,NONE,3B,ROUTE AVRECOURT,NONE,52140,MONTIGNY,FRANCE,NONE,NONE,NONE,NONE,NONE,1,RUE ANNE MARIE LEGROS,NONE,52140,MEUSE,FRANCE,NoMatch
TRANSPORT TUECH,2 rue de Congis 77440 CONGIS SUR THEROUANNE France,BA BAT,23 RUE MATTEOTI 10100 ROMILLY SUR SEINE France,NONE,NONE,NONE,NONE,NONE,2,RUE DE CONGIS,NONE,77440,CONGIS,FRANCE,NONE,NONE,NONE,NONE,NONE,23,RUE MATTEOTI,NONE,10100,ROMILLY SUR SEINE,FRANCE,NoMatch
TRANSPORT TUECH,2 rue de Congis 77440 CONGIS SUR THEROUANNE France,M MOHAMED CAMARA MOHAMED LAMINE CAMARA,33 RUE DE TORCY RDC APPT 0053 77360 VAIRES SUR MARNE France,NONE,NONE,NONE,NONE,NONE,2,RUE DE CONGIS,NONE,77440,CONGIS,FRANCE,APPARTEMENT 0053,NONE,NONE,NONE,NONE,33,RUE DE TORCY RDC,NONE,77360,VAIRES SUR MARNE,FRANCE,NoMatch
ERA TRANSPORTS,2 rue des Noisetiers 74960 Meythet France,E R A INDUSTRIES ERA INDUSTRIE,ZA LES VERNASSES RN 86 07340 SERRIERES France,NONE,NONE,NONE,NONE,NONE,2,RUE DES NOISETIERS,NONE,74960,MEYTHET,FRANCE,NONE,NONE,NONE,ZONE ARTISANALE LES VERNASSES,NONE,86,ROUTE NATIONALE,NONE,7340,SERRIERES,FRANCE,NoMatch
TRANSPORTS GARNACHE,Zi rue des salines Ecole Valentin 25004 BESANCON France,BERTO GARNACHE GARNACHE TRANSPORTS,RUE DES SALINES ZI TRANSPORTS 25480 ECOLE VALENTIN France,NONE,NONE,NONE,ZONE INDUSTRIELLE,NONE,NONE,RUE DES SALINES ECOLE VALENTIN,NONE,25004,BESANCON,FRANCE,NONE,NONE,NONE,ZONE INDUSTRIELLE TRANSPORTS,NONE,NONE,RUE DES SALINES,NONE,25480,ECOLE VALENTIN,FRANCE,NoMatch
ERA TRANSPORTS,2 rue des Noisetiers 74960 Meythet France,ORONA RHONE ALPES ENTREPRISES R\XE9GIONALES D'ASCENSEURS,LE PONTET 55 ALLEE DES ERABLES 73420 DRUMETTAZ CLARAFOND France,NONE,NONE,NONE,NONE,NONE,2,RUE DES NOISETIERS,NONE,74960,MEYTHET,FRANCE,NONE,NONE,NONE,LE PONTET,NONE,55,ALLEE DES ERABLES,NONE,73420,DRUMETTAZ CLARAFOND,FRANCE,NoMatch
TRANSPORTS GARNACHE,Zi rue des salines Ecole Valentin 25004 BESANCON France,SOCIETE GARNACHE FRERES GARNACHE FR\XE8RES,LD LES SAULES 25790 LES GRAS France,NONE,NONE,NONE,ZONE INDUSTRIELLE,NONE,NONE,RUE DES SALINES ECOLE VALENTIN,NONE,25004,BESANCON,FRANCE,NONE,NONE,NONE,NONE,NONE,NONE,LIEU DIT LES SAULES,NONE,25790,LES GRAS,FRANCE,NoMatch
RAUTUREAU S.A.,ZI de la Louisire BP 18 85290 MORTAGNE SUR SEVRE France,M GERALD THIBAUD,89 B RUE CARNOT 85300 CHALLANS France,NONE,NONE,NONE,ZONE INDUSTRIELLE DE LA LOUISIRE,NONE,NONE,NONE,BP 18,85290,MORTAGNE SUR SEVRE,FRANCE,NONE,NONE,NONE,NONE,NONE,89,RUE CARNOT,NONE,85300,CHALLANS,FRANCE,NoMatch
TRANSPORTS MATHIEU,ZI DE THIBAUD - 57 BD DE THIBAUD 31100 TOULOUSE France,MATHIEU TOULOUSE MATHIEU TRANSPORTS,9 AV DE FONTREAL EUROCENTRE CEDEX 31621 31620 VILLENEUVE LES BOULOC France,NONE,NONE,NONE,ZONE INDUSTRIELLE DE THIBAUD,NONE,57,BOULEVARD DE THIBAUD,NONE,31100,TOULOUSE,FRANCE,NONE,NONE,NONE,CENTRE FRANCE,NONE,9,AVENUE DE FONTREAL EURO,NONE,NONE,VILLENEUVE LES BOULOC,FRANCE,NoMatch
UPSILON,"45, avenue de Paris 89470 MONETEAU France",SARL UPSILON UPSILON SARL,56 AV JEAN JAURES 89000 AUXERRE France,NONE,NONE,NONE,NONE,NONE,45,AVENUE DE PARIS,NONE,89470,MONETEAU,FRANCE,NONE,NONE,NONE,NONE,NONE,56,AVENUE JEAN JAURES,NONE,89000,AUXERRE,FRANCE,NoMatch
TRANSPORTS FEUILLET,773 rue de la Plaine 01120 DAGNEUX France,SEREINE SOLUTIONS STOCKAGE,475 RUE DU PRE SEIGNEUR 01120 LA BOISSE France,NONE,NONE,NONE,NONE,NONE,773,RUE DE LA PLAINE,NONE,1120,DAGNEUX,FRANCE,NONE,NONE,NONE,NONE,NONE,475,RUE DU PRE SEIGNEUR,NONE,1120,LA BOISSE,FRANCE,NoMatch
TRANSPORTS BONNERY,L'Estrade 81660 BOUT DU PONT DE L'ARN France,RICARD GRANITS SA RICARD GRANITS SARL,300 RTE DU HAUT LANGUEDOC 81100 BURLATS France,NONE,NONE,NONE,L'ESTRADE,NONE,NONE,NONE,NONE,81660,BOUT DU PONT DE L'ARN,FRANCE,NONE,NONE,NONE,NONE,NONE,300,ROUTE DU HAUT LANGUEDOC,NONE,81100,BURLATS,FRANCE,NoMatch
SFT GONDRAND ALSACE,31 rue de BAYONNE BP 50 67020 STRASBOURG CEDEX 1 France,SFTGF S.F.T GONDRAND FR\XE8RES,13 RUE CURIE ZONE INDUSTRIELLE NORD 68000 COLMAR France,NONE,NONE,NONE,NONE,NONE,31,RUE DE BAYONNE,BP 50,67020,STRASBOURG,FRANCE,NONE,NONE,NONE,ZONE INDUSTRIELLE NORD,NONE,13,RUE CURIE,NONE,68000,COLMAR,FRANCE,NoMatch
TRANSPORTS BONNERY,L'Estrade 81660 BOUT DU PONT DE L'ARN France,STE TOFFOLI,7 RTE DE L'ARIEGE 11240 BELVEZE DU RAZES France,NONE,NONE,NONE,L'ESTRADE,NONE,NONE,NONE,NONE,81660,BOUT DU PONT DE L'ARN,FRANCE,NONE,NONE,NONE,NONE,NONE,7,ROUTE DE L'ARIEGE,NONE,11240,BELVEZE,FRANCE,NoMatch
TTOM 76,7 rue pierre Brossolette 76600 LE HAVRE France,TTOM TRAMAR TRANSIT OUTRE-MER,BD L ILE AUX OISEAUX ZONE ROUEN VALLEE DE SEINE EXPRESS 76530 GRAND COURONNE France,NONE,NONE,NONE,NONE,NONE,7,RUE PIERRE BROSSOLETTE,NONE,76600,LE HAVRE,FRANCE,NONE,NONE,NONE,ZONE ROUEN VALLEE DE SEINE EXPRESS,NONE,NONE,BOULEVARD L ILE AUX OISEAUX,NONE,76530,GRAND COURONNE,FRANCE,NoMatch
LONG COURS,centre international de fret 44550 Montoir De Bretagne France,M SEBASTIEN MIQUET,26 LD LA SIMAILLE 44650 CORCOUE SUR LOGNE France,NONE,NONE,NONE,CENTRE INTERNATIONAL DE FRET,NONE,NONE,NONE,NONE,44550,MONTOIR DE BRETAGNE,FRANCE,NONE,NONE,NONE,NONE,NONE,26,LIEU DIT LA SIMAILLE,NONE,44650,CORCOUE SUR LOGNE,FRANCE,NoMatch
DENIAU ALAIN,La Carte 37380 MONNAIE France,M PHILIPPE DUBOIS,18 AV DES DROITS DE L HOMME 37230 FONDETTES France,NONE,NONE,NONE,LA CARTE,NONE,NONE,NONE,NONE,37380,MONNAIE,FRANCE,NONE,NONE,NONE,NONE,NONE,18,AVENUE DES DROITS DE L HOMME,NONE,37230,FONDETTES,FRANCE,NoMatch
TRANSPORTS CHARPENTIER,LE PALLET BP 29 44194 CLISSON CEDEX FRANCE,TRANSPORTS CHARPENTIER CHARPENTIER TRANSPORTS,LD LA COGNARDIERE 44330 LE PALLET France,NONE,NONE,NONE,LE PARC ACTIVITELLET,NONE,NONE,NONE,BP 29,44194,CLISSON,FRANCE,NONE,NONE,NONE,NONE,NONE,NONE,LIEU DIT LA COGNARDIERE,NONE,44330,LE PALLET,FRANCE,NoMatch
TRANSPORTS BECQUET,255 avenue Maurice Berteaux 59430 SAINT POL SUR MER France,MME ISABELLE BECQUET,93 B RTE NATIONALE 59114 SAINT SYLVESTRE CAPPEL France,NONE,NONE,NONE,NONE,NONE,255,AVENUE MAURICE BERTEAUX,NONE,59430,SAINT POL SUR MER,FRANCE,NONE,NONE,NONE,NONE,NONE,93 B,ROUTE NATIONALE,NONE,59114,SAINT SYLVESTRE,FRANCE,NoMatch
TRANSPORTS BECQUET,255 avenue Maurice Berteaux 59430 SAINT POL SUR MER France,BECQUET SAS BECQUET,RUE MAURICE BERTEAUX 59430 DUNKERQUE France,NONE,NONE,NONE,NONE,NONE,255,AVENUE MAURICE BERTEAUX,NONE,59430,SAINT POL SUR MER,FRANCE,NONE,NONE,NONE,NONE,NONE,NONE,RUE MAURICE BERTEAUX,NONE,59430,DUNKERQUE,FRANCE,NoMatch
TRANSPORTS AUJOL,LA CHAPELLE 19800 CORREZE FRANCE,M PHILIPPE MALISSARD,AUJOL 19270 SAINTE FEREOLE France,NONE,NONE,NONE,LA CHAPELLE,NONE,NONE,NONE,NONE,19800,CORREZE,FRANCE,NONE,NONE,NONE,AUJOL,NONE,NONE,NONE,NONE,19270,SAINTE FEREOLE,FRANCE,NoMatch
FRANCILIENNE DE TRANSPORTS,6 RUE DE LA PIERRE FOLLEGE 91660 MEREVILLE FRANCE,DESSERTE FRANCILIENNE,22 AVENUE PAUL LANGEVIN BATIMENT HERBLAY I 95220 HERBLAY France,NONE,NONE,NONE,NONE,NONE,6,RUE DE LA PIERRE FOLLEGE,NONE,91660,MEREVILLE,FRANCE,NONE,BATIMENT HERBLAY I,NONE,NONE,NONE,22,AVENUE PAUL LANGEVIN,NONE,95220,HERBLAY,FRANCE,NoMatch
TRANS AUSCITAINE,2 rue Claude Monet 32000 AUCH France,M BENOIT ESPLANDES,LD LA BATISSE 32430 SAINT GEORGES France,NONE,NONE,NONE,NONE,NONE,2,RUE CLAUDE MONET,NONE,32000,AUCH,FRANCE,NONE,NONE,NONE,NONE,NONE,NONE,LIEU DIT LA BATISSE,NONE,32430,SAINT GEORGES,FRANCE,NoMatch
TRANSPORTS DE MARCHANDISE PEYRALANS,RUE PRINCIPALE 64160 SAINT CASTIN FRANCE,SARL CPS CPS SARL,1213 AV DU MAL FOCH 40990 SAINT PAUL LES DAX France,NONE,NONE,NONE,NONE,NONE,NONE,RUE PRINCIPALE,NONE,64160,SAINT CASTIN,FRANCE,NONE,NONE,NONE,NONE,NONE,1213,AVENUE DU MAL FOCH,NONE,40990,SAINT PAUL,FRANCE,NoMatch
SCHENKER 33 - JOYAU 33 LORMONT,Za La Gardette - Rue du Courant 33310 LORMONT France,SCHENKER FRANCE DB SCHENKER,ZI CENTRE INT DE FRET ZI DE BRUGES 33520 BRUGES France,NONE,NONE,NONE,ZONE ARTISANALE LA GARDETTE,NONE,NONE,RUE DU COURANT,NONE,33310,LORMONT,FRANCE,NONE,NONE,NONE,ZONE INDUSTRIELLE CENTRE INT DE FRET ZONE INDUSTRIELLE DE BRUGES,NONE,NONE,NONE,NONE,33520,BRUGES,FRANCE,NoMatch
TAXI STEPHANE,RUE DE LA NOUE MULETTE 44260 SAVENAY FRANCE,M JACQUES VERA,8 ALL PAUL CLAUDEL 44800 SAINT HERBLAIN France,NONE,NONE,NONE,NONE,NONE,NONE,RUE DE LA NOUE MULETTE,NONE,44260,SAVENAY,FRANCE,NONE,NONE,NONE,NONE,NONE,8,ALLEE PAUL CLAUDEL,NONE,44800,SAINT HERBLAIN,FRANCE,NoMatch
CDR TRANSPORT,5 IMPASSE DE L ARMATEUR 77390 YEBLES France,M CHRISTOPHE PENFORNIS CDR TRANSPORT,349 BD ETIENNE CLEMENTEL 63100 CLERMONT FERRAND France,NONE,NONE,NONE,NONE,NONE,5,IMPASSE DE L ARMATEUR,NONE,77390,YEBLES,FRANCE,NONE,NONE,NONE,NONE,NONE,349,BOULEVARD ETIENNE CLEMENTEL,NONE,63100,CLERMONT FERRAND,FRANCE,NoMatch
CDR TRANSPORT,5 IMPASSE DE L ARMATEUR 77390 YEBLES France,M CHRISTOPHE PENFORNIS CDR TRANSPORT,349 BD ETIENNE CLEMENTEL 63100 CLERMONT FERRAND France,NONE,NONE,NONE,NONE,NONE,5,IMPASSE DE L ARMATEUR,NONE,77390,YEBLES,FRANCE,NONE,NONE,NONE,NONE,NONE,349,BOULEVARD ETIENNE CLEMENTEL,NONE,63100,CLERMONT FERRAND,FRANCE,NoMatch
FRANCILIENNE DE TRANSPORTS,6 RUE DE LA PIERRE FOLLEGE 91660 MEREVILLE FRANCE,FRANCILIENNE DE TRANSPORTS ET SERVICES,14 RUE BICENTENAIRE DE LA REVOLUTION 91220 LE PLESSIS PATE France,NONE,NONE,NONE,NONE,NONE,6,RUE DE LA PIERRE FOLLEGE,NONE,91660,MEREVILLE,FRANCE,NONE,NONE,NONE,NONE,NONE,14,RUE BICENTENAIRE DE LA REVOLUTION,NONE,91220,LE PLESSIS PATE,FRANCE,NoMatch
TRANSPORTS GILLES VIEILLARD SARL,"11, Rue des moines 27910 RENNEVILLE France",SARL VIEILLARD LOGISTIQUE,ZA LA MALADRERIE 27380 BOURG BEAUDOUIN France,NONE,NONE,NONE,NONE,NONE,11,RUE DES MOINES,NONE,27910,RENNEVILLE,FRANCE,NONE,NONE,NONE,ZONE ARTISANALE LA MALADRERIE,NONE,NONE,NONE,NONE,27380,BOURG BEAUDOUIN,FRANCE,NoMatch
DPORT STOCK ( PRESTATAIRE LOGISTIQUE ),22 rue de la Mollanche 42290 Sorbiers France,EASYDIS ENTREPOT CASINO,26 RUE DE LA TALAUDIERE 42000 SAINT ETIENNE France,NONE,NONE,NONE,NONE,NONE,22,RUE DE LA MOLLANCHE,NONE,42290,SORBIERS,FRANCE,NONE,NONE,NONE,NONE,NONE,26,RUE DE LA TALAUDIERE,NONE,42000,SAINT ETIENNE,FRANCE,NoMatch
LE CALVEZ LOGISTIQUE,6 IMPASSE DU RUISSEAU 35530 NOYAL SUR VILAINE France,SLC SEBASTIEN LE CALVEZ,LA FONTAINE AUX LIEVRES 35400 SAINT MALO France,NONE,NONE,NONE,NONE,NONE,6,IMPASSE DU RUISSEAU,NONE,35530,NOYAL,FRANCE,NONE,NONE,NONE,LA FONTAINE AUX LIEVRES,NONE,NONE,NONE,NONE,35400,SAINT MALO,FRANCE,NoMatch
STEF TRANSPORT COTE D'AZUR,120 Rue Docteur Calmette BP 13 83130 LA GARDE CEDEX France,STEF TRANSPORT COTE D AZUR STEF TRANSPORT C\XF4TE D'AZUR,AV ZI 4EME AVENUE ZI DE CARROS 13EME RUE 06510 CARROS France,NONE,NONE,NONE,NONE,NONE,120,RUE DOCTEUR CALMETTE,BP 13,83130,LA GARDE,FRANCE,NONE,NONE,NONE,ZONE INDUSTRIELLE 4 EME ZONE INDUSTRIELLE DE CARROS 13 EME RUE,NONE,NONE,AVENUE,NONE,6510,CARROS,FRANCE,NoMatch
BONNET JEAN PAUL,GUYOR HAUT 81260 LE BEZ FRANCE,M JEAN BONNET,GUYOR HAUT 81260 LE BEZ France,NONE,NONE,NONE,GUYOR HAUT,NONE,NONE,NONE,NONE,81260,LE BEZ,FRANCE,NONE,NONE,NONE,GUYOR HAUT,NONE,NONE,NONE,NONE,81260,LE BEZ,FRANCE,Match
TRANSPORTS BROYER NOLIN,Rue de la Libert 08000 LES AYELLES France,ETABLISSEMENTS BROYER FRERES,49 RUE DE SEDAN 08000 LES AYVELLES France,NONE,NONE,NONE,NONE,NONE,NONE,RUE DE LA LIBERT,NONE,8000,LES AYELLES,FRANCE,NONE,NONE,NONE,NONE,NONE,49,RUE DE SEDAN,NONE,8000,LES AYVELLES,FRANCE,NoMatch
TRANSPORTS CAPOROSSI ( TRANSPORT CORSE 20 ),P.A. de Purettone 20290 Borgo (Corsica) France,CORS'DISCOUNT,LD CAMPO MELO ZI TRAGONE 20620 BIGUGLIA France,NONE,NONE,NONE,PARC D'ACTIVITE DE PURETTONE,NONE,NONE,NONE,NONE,20290,BORGO (CORSICA),FRANCE,NONE,NONE,NONE,ZONE INDUSTRIELLE TRAGONE,NONE,NONE,LIEU DIT CAMPO MELO,NONE,20620,BIGUGLIA,FRANCE,NoMatch
SOLANILLA,24 rue Laplace ZI du Phare 33700 MERIGNAC France,2AEI AQUITAINE AUTOMATISME ET ELECTRICITE INDUSTRIELLE,212 RTE DU STADE 33650 SAINT MORILLON France,NONE,NONE,NONE,ZONE INDUSTRIELLE DU PHARE,NONE,24,RUE LA PLACE,NONE,33700,MERIGNAC,FRANCE,NONE,NONE,NONE,NONE,NONE,212,ROUTE DU STADE,NONE,33650,SAINT MORILLON,FRANCE,NoMatch
TRANSPORTS GARRAUD,102 CHEMIN BOUDOU 31140 LAUNAGUET FRANCE,ETABLISSEMENTS GARAUD,RTE DE BRAM LIEU DIT L'ARNOUZE 11000 CARCASSONNE France,NONE,NONE,NONE,NONE,NONE,102,CHEMIN BOUDOU,NONE,31140,LAUNAGUET,FRANCE,NONE,NONE,NONE,NONE,NONE,NONE,ROUTE DE BRAM LIEU DIT L'ARNOUZE,NONE,11000,CARCASSONNE,FRANCE,NoMatch
TRANSPORTS GENDREU,CHEMIN DES CLOTTES 81600 GAILLAC FRANCE,M MOISE GALTIER,LD MONTEGUT 81320 MURAT SUR VEBRE France,NONE,NONE,NONE,NONE,NONE,NONE,CHEMIN DES CLOTTES,NONE,81600,GAILLAC,FRANCE,NONE,NONE,NONE,NONE,NONE,NONE,LIEU DIT MONTEGUT,NONE,81320,MURAT,FRANCE,NoMatch
BLANCHET TRANSPORTS,Zone Industrielle 51230 CONNANTRE France,SARL CALITOL,9 RUE DES MARCOTS ZI CHEMIN DU PARC 95480 PIERRELAYE France,NONE,NONE,NONE,ZONE INDUSTRIELLE,NONE,NONE,NONE,NONE,51230,CONNANTRE,FRANCE,NONE,NONE,NONE,ZONE INDUSTRIELLE CHEMIN DU PARC ACTIVITERC,NONE,9,RUE DES MARCOTS,NONE,95480,PIERRELAYE,FRANCE,NoMatch
TRANSPORTS BARTOLI,7 Rue Maurice Mauchauffe 10000 TROYES France,M DENIS PERROSSIER,28 AV DE LA GARE 10130 ERVY LE CHATEL France,NONE,NONE,NONE,NONE,NONE,7,RUE MAURICE MAUCHAUFFE,NONE,10000,TROYES,FRANCE,NONE,NONE,NONE,NONE,NONE,28,AVENUE DE LA GARE,NONE,10130,ERVY LE CHATEL,FRANCE,NoMatch
MACHERAS ALAIN,ROUTE MALVILLERS 70120 MELIN FRANCE,MONSIEUR ALAIN MELIN,20 RUE DE CHAUSSEROY 86170 CISSE France,NONE,NONE,NONE,NONE,NONE,NONE,ROUTE MALVILLERS,NONE,70120,MELIN,FRANCE,NONE,NONE,NONE,NONE,NONE,20,RUE DE CHAUSSEROY,NONE,86170,CISSE,FRANCE,NoMatch
GRUMTRANSPORT,61 BIS RUE TUILERIE 41250 MONT PRES CHAMBORD FRANCE,M THIERRY BENARD,8 RUE DE LA CANARDIERE 41360 SAVIGNY SUR BRAYE France,NONE,NONE,NONE,NONE,NONE,61 BIS,RUE TUILERIE,NONE,41250,MONT PRES CHAMBORD,FRANCE,NONE,NONE,NONE,NONE,NONE,8,RUE DE LA CANARDIERE,NONE,41360,SAVIGNY,FRANCE,NoMatch
TRANSPORTS BARTOLI,7 Rue Maurice Mauchauffe 10000 TROYES France,MME STEPHANIE VALLOIS,4 RUE DE LA CRAYERE 10100 SAINT LOUP DE BUFFIGNY France,NONE,NONE,NONE,NONE,NONE,7,RUE MAURICE MAUCHAUFFE,NONE,10000,TROYES,FRANCE,NONE,NONE,NONE,NONE,NONE,4,RUE DE LA CRAYERE,NONE,10100,SAINT LOUP,FRANCE,NoMatch
TRANSERVICES,19 Rue Montrobert 10370 VILLENAUXE LA GRANDE France,M GREGORY FEVRE SERVI 10 TRANS.TAXI,16 RUE DE L'EGLISE 10220 BOUY LUXEMBOURG France,NONE,NONE,NONE,NONE,NONE,19,RUE MONTROBERT,NONE,10370,VILLENAUXE,FRANCE,NONE,NONE,NONE,NONE,NONE,16,RUE DE L'EGLISE,NONE,10220,BOUY LUXEMBOURG,FRANCE,NoMatch
TRANSPORTS COTTIN,"145, av. Henri BARBUSSE 92700 COLOMBES France",M OLIVIER COTTIN,55 CHE DE SAINTE COLOMBE LE CLOS SAINT MICHEL N 2 06800 CAGNES SUR MER France,NONE,NONE,NONE,NONE,NONE,145,AVENUE HENRI BARBUSSE,NONE,92700,COLOMBES,FRANCE,NONE,NONE,NONE,NONE,NONE,55,CHEMIN DE SAINTE COLOMBE,NONE,6800,CAGNES SUR MER,FRANCE,NoMatch
TRANSPORTS LEJEUNE,RUE DU MARAIS 08270 CORNY MACHEROMENIL FRANCE,SOPAP AUTOMATION,RUE HENRI FAURE PARC ARDENNES EMERAUDE 08090 TOURNES France,NONE,NONE,NONE,NONE,NONE,NONE,RUE DU MARAIS,NONE,8270,CORNY MACHEROMENIL,FRANCE,NONE,NONE,NONE,PARC ACTIVITERC ARDENNES EMERAUDE,NONE,NONE,RUE HENRI FAURE,NONE,8090,TOURNES,FRANCE,NoMatch
TRANSPORTS AUJOL,LA CHAPELLE 19800 CORREZE FRANCE,TRANSPORT AUJOL,1 RTE NATIONALE 19800 EYREIN France,NONE,NONE,NONE,LA CHAPELLE,NONE,NONE,NONE,NONE,19800,CORREZE,FRANCE,NONE,NONE,NONE,NONE,NONE,1,ROUTE NATIONALE,NONE,19800,EYREIN,FRANCE,NoMatch
RUSH TRANSPORTS,39 RUE DU DOCTEUR POIRE 93200 SAINT DENIS France,MONSIEUR ADIL EL BNAOUI GOLD RUSH,22 RUE DES PEUPLIERS 93000 BOBIGNY France,NONE,NONE,NONE,NONE,NONE,39,RUE DU DOCTEUR POIRE,NONE,93200,SAINT DENIS,FRANCE,NONE,NONE,NONE,NONE,NONE,22,RUE DES PEUPLIERS,NONE,93000,BOBIGNY,FRANCE,NoMatch
TRANSPORTS AUJOL,LA CHAPELLE 19800 CORREZE FRANCE,TRANSPORT AUJOL,1 RTE NATIONALE 19800 EYREIN France,NONE,NONE,NONE,LA CHAPELLE,NONE,NONE,NONE,NONE,19800,CORREZE,FRANCE,NONE,NONE,NONE,NONE,NONE,1,ROUTE NATIONALE,NONE,19800,EYREIN,FRANCE,NoMatch
MONTE MEUBLES SERVICES,"7, ALLE VANDME 93190 LIVRY-GARGAN FRANCE",TRANSPORTS F A U D\XE9M\XE9NAGEMENTS GILBERT MORIN,21 RUE MARC SEGUIN 21 77290 COMPANS France,NONE,NONE,NONE,NONE,NONE,7,ALLE VANDME,NONE,93190,LIVRY GARGAN,FRANCE,NONE,NONE,NONE,NONE,NONE,21,RUE MARC SEGUIN,NONE,77290,COMPANS,FRANCE,NoMatch
ESTIMAT,15 rue Moulins 57920 KEDANGE SUR CANNER France,YUMITY3,14 RUE SAINT MARTIN 57120 PIERREVILLERS France,NONE,NONE,NONE,NONE,NONE,15,RUE MOULINS,NONE,57920,KEDANGE SUR CANNER,FRANCE,NONE,NONE,NONE,NONE,NONE,14,RUE SAINT MARTIN,NONE,57120,PIERREVILLERS,FRANCE,NoMatch
HOP HOP COURSES,2 Rue Thomas Edison 67450 MUNDOLSHEIM France,M JULIEN SELAME,12 RUE DE L ESPERANCE JULIEN SELAME 67400 ILLKIRCH GRAFFENSTADEN France,NONE,NONE,NONE,NONE,NONE,2,RUE THOMAS EDISON,NONE,67450,MUNDOLSHEIM,FRANCE,NONE,NONE,NONE,NONE,NONE,12,RUE DE L ESPERANCE JULIEN SELAME,NONE,67400,ILLKIRCH GRAFFENSTADEN,FRANCE,NoMatch
EQUIPART FRERES,ZI N2 de prouvy rouvignies 59309 VALENCIENNES France,SOCIETE EQUIPART FRERES EQUIPART FR\XE8RES,1 COMPLEXE ROUTIER 59121 PROUVY France,NONE,NONE,NONE,ZONE INDUSTRIELLE N2 DE PROUVY ROUVIGNIES,NONE,NONE,NONE,NONE,59309,VALENCIENNES,FRANCE,NONE,NONE,NONE,NONE,NONE,1,COMPLEXE ROUTIER,NONE,59121,PROUVY,FRANCE,NoMatch
HEMMERLIN,35 rue d'Yvours 69540 IRIGNY France,HEMMERLIN SWISS AG,imp. du Nouveau March\xe9  1723 Marly Suisse,NONE,NONE,NONE,NONE,NONE,35,RUE D'YVOURS,NONE,69540,IRIGNY,FRANCE,NONE,NONE,NONE,NONE,NONE,NONE,IMPASSE DU NOUVEAU MARCHE,NONE,NONE,MARLY,FRANCE,NoMatch
